Fehezanteny,Sokajinteny
"""Ary hoy Izy: Ento ny zanakao, ny lahitokanao izay tianao, dia Isaka ka mankanesa any amin'ny tany Moria; ary atero any izy ho fanatitra dorana ao amin'ny tendrombohitra anankiray izay holazaiko aminao.""",Mpampitohy Mpamaritra Mpisolo Matoanteny Mpanoritra Anarana Mpanoritra Anarana Mpisolo Anarana Kianteny Anarana Kianteny Matoanteny Tambinteny Mpampiankina Mpanoritra Anarana Anarana Mpampitohy Matoanteny Tambinteny Mpisolo Kianteny Matoanteny Anarana Tambinteny Mpampiankina Mpanoritra Anarana Anarana Mpisolo Matoanteny Mpampiankina
"""Ary nifoha maraina koa Abrahama dia nanisy lasely ny borikiny ka nitondra zatovony roa lahy koa niaraka taminy sy Isaka zanany ary namaky ny hazo hataina amin'ny fanatitra dorana izy dia niainga ka nankany amin'ny tany izay efa nolazain'Andriamanitra taminy.""",Mpampitohy Matoanteny Matoanteny Kianteny Anarana Kianteny Matoanteny Anarana Mpanoritra Anarana Kianteny Matoanteny Anarana Mpamaritra Anarana Kianteny Matoanteny Mpampiankina Mpampitohy Anarana Anarana Mpampitohy Matoanteny Mpanoritra Anarana Matoanteny Mpampiankina Mpanoritra Anarana Matoanteny Mpisolo Kianteny Matoanteny Kianteny Matoanteny Mpampiankina Mpanoritra Anarana Mpisolo Tambinteny Matoanteny Anarana Mpampiankina
"""Nony tamin'ny andro fahatelo Abrahama dia nanopy ny masony ka nahatazana ny tany terỳ lavitra erỳ.""",Mpampitohy Mpampiankina Mpanoritra Anarana Mpamaritra Anarana Kianteny Matoanteny Mpanoritra Anarana Kianteny Matoanteny Mpanoritra Anarana Tambinteny Mpamaritra Tambinteny
"""Ary hoy Abrahama tamin'ny zatovony: Mijanòna eto amin'ny boriky ianareo, fa izaho sy ny zazalahy handeha hankerỳ; ary hivavaka izahay dia hiverina eto aminareo indray.""",Mpampitohy Mpamaritra Anarana Mpampiankina Mpanoritra Anarana Matoanteny Tambinteny Mpampiankina Mpanoritra Anarana Mpisolo Tambinteny Mpisolo Mpampitohy Mpanoritra Anarana Matoanteny Matoanteny Mpampitohy Matoanteny Mpisolo Kianteny Matoanteny Tambinteny Mpampiankina Tambinteny
"""Dia nalain'i Abrahama ny hazo hataina amin'ny fanatitra dorana ka natataony an'Isaka zanany; fa izy kosa nitondra ny afo sy ny antsy teny an-tànany; ary dia niara-nandeha izy mianaka.""",Mpampitohy Matoanteny Mpanoritra Anarana Mpanoritra Anarana Matoanteny Mpampiankina Mpanoritra Anarana Mpamaritra Kianteny Matoanteny Tambinteny Anarana Anarana Tambinteny Mpisolo Mpampitohy Matoanteny Mpanoritra Anarana Mpampitohy Mpanoritra Anarana Tambinteny Tambinteny Anarana Mpampitohy Kianteny Matoanteny Matoanteny Mpisolo Anarana
"""Ary Isaka niteny tamin'i Abrahama rainy ka nanao hoe: Ry ikaky ô! dia hoy izy: Inty aho, anaka.""",Mpampitohy Anarana Matoanteny Mpampiankina Mpanoritra Anarana Anarana Kianteny Matoanteny Tambinteny Kianteny Anarana Tenim-piotanana Kianteny Mpamaritra Mpisolo Mpisolo Mpisolo Anarana
"""Ary hoy izy: Indreto ny afo sy ny kitay; fa aiza kosa izay ondry hatao fanatitra dorana?""",Mpampitohy Mpamaritra Mpisolo Tambinteny Mpanoritra Anarana Mpampitohy Mpanoritra Anarana Tambinteny Tambinteny Mpampitohy Mpisolo Anarana Matoanteny Anarana Anarana
"""Fa hoy Abrahama: Anaka.""",Tambinteny Mpamaritra Anarana Anarana
"""Andriamanitra no hahita izay ondry hatao fanatitra dorana; dia niara-nandeha izy mianaka.""",Anarana Kianteny Matoanteny Mpisolo Anarana Matoanteny Anarana Anarana Kianteny Matoanteny Matoanteny Mpisolo Anarana
"""Ary rehefa tonga teo amin'ny tany izay efa nolazain'Andriamanitra taminy izy, dia nanorina ny alitara teo Abrahama ka nandahatra ny kitay; dia namatotra an'i Isaka zanany izy ka nametraka azy tambonin'ny alitara teo ambonin'ny kitay.""",Mpampitohy Tambinteny Matoanteny Tambinteny Mpampiankina Mpanoritra Anarana Mpisolo Tambinteny Matoanteny Anarana Mpampiankina Mpisolo Kianteny Matoanteny Mpanoritra Anarana Tambinteny Anarana Kianteny Matoanteny Mpanoritra Anarana Kianteny Matoanteny Tambinteny Mpanoritra Anarana Anarana Mpisolo Kianteny Matoanteny Mpisolo Tambinteny Mpanoritra Anarana Tambinteny Tambinteny Mpanoritra Anarana
"""Ary Abrahama naninjitra ny tànany ka nandray ny antsy mba hamonoany ny zanany.""",Mpampitohy Anarana Matoanteny Mpanoritra Anarana Kianteny Matoanteny Mpanoritra Anarana Kianteny Matoanteny Mpanoritra Anarana
"""Fa niantso azy Ilay Anjelin'i Jehovah tany an-danitra ka nanao hoe: Ry Abrahama, ry Abrahama ô! ary hoy kosa izy: Inty aho.""",Tambinteny Matoanteny Mpisolo Mpanoritra Anarana Mpanoritra Anarana Anarana Tambinteny Anarana Kianteny Matoanteny Tambinteny Kianteny Anarana Tenim-piotanana Mpampitohy Mpamaritra Mpampitohy Mpisolo Mpisolo Mpisolo 
"""Dia hoy Izy: Aza maninjitra ny tananao amin'ny zazalahy, ary aza maninona azy akory ianao; fa hitako izao fa matahotra an'Andriamanitra ianao, ka tsy narovanao tamiko ny zanakao, dia ny lahitokanao.""",Mpampitohy Mpamaritra Mpisolo Kianteny Matoanteny Mpanoritra Anarana Mpampiankina Mpanoritra Anarana Mpampitohy Kianteny Matoanteny Mpisolo Tambinteny Mpisolo Tambinteny Matoanteny Mpisolo Tambinteny Matoanteny Tambinteny Anarana Mpisolo Kianteny Tambinteny Matoanteny Mpampiankina Mpanoritra Anarana Kianteny Mpanoritra Anarana
"""Ary Abrahama niherika nijery ka, indro, nisy ondrilahy teo ivohony, voasangazotry ny kirihitrala ny tandrony; dia lasa Abrahama ka naka ny ondrilahy ary nanatitra azy ho fanatitra dorana ho solon'ny zanany.""",Mpampitohy Anarana Matoanteny Matoanteny Kianteny Tambinteny Matoanteny Anarana Tambinteny Anarana Matoanteny Mpanoritra Anarana Mpanoritra Anarana Kianteny Mpamaritra Anarana Kianteny Matoanteny Mpanoritra Anarana Mpanoritra Matoanteny Mpisolo Kianteny Anarana Mpamaritra Kianteny Anarana Mpanoritra Anarana
"""Ary ny anaran'izany tany izany dia nataon'i Abrahama hoe Jehovah-jire; dia izany no anaovana mandraka ankehitriny ny hoe: Any an-tendrombohitra no hisehoan'i Jehovah.""",Mpampitohy Mpanoritra Anarana Mpisolo Tambinteny Mpisolo Kianteny Matoanteny Mpanoritra Anarana Tambinteny Anarana Anarana Kianteny Mpisolo Kianteny Matoanteny Tambinteny Tambinteny Mpanoritra Tambinteny Tambinteny Tambinteny Anarana Kianteny Matoanteny Mpanoritra Anarana
"""Dia niantso an'i Abrahama fanindroany tany an-danitra Ilay Anjelin'i Jehovah ka nanao hoe: Ny tenako no nianianako, hoy Jehovah: Satria nanao izany zavatra izany ianao ka tsy niaro ny zanakao, ilay lahitokanao, dia hitahy anao tokoa Aho ary hahamaro dia hahamaro ny taranakao, ho tahaka ny kintana eny amin'ny lanitra sy ho tahaka ny fasika izay any amoron-dranomasina; ary ny taranakao hahazo ny vavahadin'ny fahavalony; ary amin'ny taranakao no hitahiana ny firenena rehetra ambonin'ny tany, satria nanaiky ny teniko ianao.""",Mpampitohy Matoanteny Tambinteny Mpanoritra Anarana Tambinteny Tambinteny Tambinteny Anarana Mpanoritra Anarana Mpanoritra Anarana Kianteny Matoanteny Tambinteny Mpanoritra Anarana Kianteny Matoanteny Mpamaritra Anarana Mpampitohy Matoanteny Mpisolo Anarana Mpisolo Mpisolo Kianteny Tambinteny Matoanteny Mpanoritra Anarana Mpanoritra Anarana Kianteny Matoanteny Mpisolo Tambinteny Mpisolo Mpampitohy Matoanteny Kianteny Matoanteny Mpanoritra Anarana Kianteny Mpamaritra Mpanoritra Anarana Mpisolo Tambinteny Tambinteny Anarana Mpampitohy Mpanoritra Anarana Matoanteny Mpanoritra Anarana Mpanoritra Anarana Mpampitohy Mpampiankina Mpanoritra Anarana Kianteny Matoanteny Mpanoritra Anarana Mpamaritra Tambinteny Mpanoritra Anarana Mpampitohy Matoanteny Mpanoritra Anarana Mpisolo
"""Ary Abrahama dia niverina nankeny amin'ny zatovony; dia niainga izy ka niaraka nankany Beri-sheba; ary Abrahama dia nonina tany Beri-sheba.""",Mpampitohy Anarana Kianteny Matoanteny Matoanteny Mpampiankina Mpanoritra Anarana Kianteny Matoanteny Mpisolo Kianteny Matoanteny Matoanteny Anarana Anarana Mpampitohy Anarana Kianteny Matoanteny Tambinteny Anarana Anarana
"""Ary rehefa afaka izany, dia nisy nanambara tamin'i Abrahama hoe: Indro, efa niteraka zazalahy koa Milka tamin'i Nahora rahalahinao, dia Oza lahimatoany sy Boza lahiaivo ary Kemoela, rain'i Arama, ary Kaseda sy Hazo sy Pildasy sy Jidiafa ary Betoela.""",Mpampitohy Tambinteny Matoanteny Mpisolo Kianteny Matoanteny Matoanteny Mpampiankina Mpanoritra Anarana Tambinteny Tambinteny Tambinteny Matoanteny Anarana Kianteny Anarana Mpampiankina Mpanoritra Anarana Anarana Kianteny Anarana Anarana Mpampitohy Anarana Anarana Mpampitohy Anarana Anarana Mpanoritra Anarana Mpampitohy Anarana Mpampitohy Mpampitohy Anarana Mpampitohy Anarana Mpampitohy Anarana
"""Ary Betoela niteraka an-dRebeka.""",Mpampitohy Anarana Matoanteny Tambinteny Anarana
"""Ireo valo ireo no naterak'i Milka tamin'i Nahora, rahalahin'i Abrahama.""",Mpisolo Mpamaritra Mpisolo Kianteny Matoanteny Mpanoritra Anarana Mpampiankina Mpanoritra Anarana Anarana Mpanoritra Anarana
"""Ary ny vaditsindranony, izay atao hoe Reoma, izy koa dia niteraka an'i Teba sy Gahama sy Tahasy ary Meaka.""",Mpampitohy Mpanoritra Anarana Mpisolo Matoanteny Tambinteny Anarana Mpisolo Kianteny Tambinteny Matoanteny Tambinteny Mpanoritra Anarana Mpampitohy Anarana Mpampitohy Anarana Mpampitohy Anarana
"""Ary ny andro niainan'i Saraha dia fito amby roa-polo amby zato taona; izany no taona niainan'i Saraha.""",Mpampitohy Mpanoritra Anarana Matoanteny Mpanoritra Anarana Kianteny Mpamaritra Anarana Mpamaritra Mpamaritra Anarana Mpamaritra Anarana Mpisolo Kianteny Anarana Matoanteny Mpanoritra Anarana
"""Ary Saraha dia maty tao Kiriat-arba (Hebrona izany) tany amin'ny tany Kanana; dia tonga Abrahama hisaona an'i Saraha sy hitomany azy.""",Mpampitohy Anarana Kianteny Matoanteny Tambinteny Anarana Anarana Anarana Mpisolo Tambinteny Mpampiankina Mpanoritra Tambinteny Anarana Kianteny Matoanteny Anarana Matoanteny Tambinteny Mpanoritra Anarana Mpampitohy Matoanteny Mpanoritra
"""Ary Abrahama nitsangana niala avy teo anilan'ny fatin'ny vadiny, dia niteny tamin'ny taranak'i Heta ka nanao hoe: Vahiny sy mpivahiny eto aminareo aho; omeo tany fandevenana eto aminareo aho mba handevenako ny fatin'ny vadiko tsy ho eto anatrehako.""",Mpampitohy Anarana Matoanteny Matoanteny Mpamaritra Tambinteny Tambinteny Mpanoritra Anarana Mpanoritra Anarana Kianteny Matoanteny Mpampiankina Mpanoritra Anarana Mpanoritra Anarana Kianteny Matoanteny Tambinteny Anarana Mpampitohy Anarana Tambinteny Mpampiankina Mpisolo Matoanteny Tambinteny Anarana Tambinteny Mpampiankina Mpisolo Kianteny Matoanteny Mpanoritra Anarana Mpanoritra Anarana Tambinteny Kianteny Tambinteny Anarana
"""Dia namaly an'i Abrahama ny taranak'i Heta ka nanao taminy hoe: Mihainoa anay, tompokolahy: andrian-dehibe eto aminay ianao; koa izay tsara indrindra amin'ny fasanay no andeveno ny fatin'ny vadinao; tsy misy aminay hiaro ny fasany aminao tsy handevenanao ny fatin'ny vadinao.""",Mpampitohy Matoanteny Tambinteny Mpanoritra Anarana Mpanoritra Anarana Mpanoritra Anarana Kianteny Matoanteny Mpampiankina Tambinteny Matoanteny Mpisolo Anarana Anarana Mpamaritra Tambinteny Mpampiankina Mpisolo Kianteny Mpisolo Mpamaritra Tambinteny Mpampiankina Mpampitohy Anarana Kianteny Matoanteny Mpanoritra Anarana Mpanoritra Anarana Tambinteny Matoanteny Mpampiankina Matoanteny Mpanoritra Anarana Mpampiankina Tambinteny Matoanteny Mpanoritra Matoanteny Mpanoritra Anarana
"""Dia nitsangana Abrahama ka niankohoka teo anatrehan'ny taranak'i Heta tompon-tany, dia niteny taminy ka nanao hoe: Raha sitrakareo ary ny handevenako ny fatin'ny vadiko mba tsy ho eto anatrehako, dia mihainoa ahy, ka mba iangavio kely amin'i Efrona, zanak'i Zohara, mba homeny ahy ny zohy ao Makpela izay azy, dia ilay eo amin'ny sisin'ny sahany; amin'izay vola tokom-bidiny no aoka hanomezany azy ho ahy eto aminareo ho tany fandevenana.""",Mpampitohy Matoanteny Anarana Kianteny Matoanteny Tambinteny Tambinteny Mpanoritra Anarana Mpanoritra Anarana Anarana Anarana Kianteny Matoanteny Mpampiankina Kianteny Matoanteny Tambinteny Mpampitohy Matoanteny Mpampitohy Mpanoritra Anarana Mpanoritra Anarana Mpanoritra Anarana Kianteny Tambinteny Kianteny Tambinteny Tambinteny Kianteny Matoanteny Mpisolo Kianteny Kianteny Matoanteny Mpamaritra Mpampiankina Mpanoritra Anarana Anarana Mpanoritra Anarana Kianteny Matoanteny Mpisolo Mpanoritra Anarana Tambinteny Anarana Mpisolo Mpisolo Kianteny Mpanoritra Tambinteny Mpampiankina Mpisolo Tambinteny Mpanoritra Anarana Mpampiankina Mpisolo Anarana Anarana Anarana Kianteny Tenim-piotanana Matoanteny Mpisolo Kianteny Mpisolo Tambinteny Mpampiankina Kianteny Anarana Anarana
"""Ary Efrona nipetraka teo amin'ny taranak'i Heta; dia namaly an'i Abrahama Efrona Hetita teo anatrehan'ny taranak'i Heta, dia izay rehetra niditra teo am-bavahadin'ny tanànany, ka nanao hoe: Tsia, tompokolahy, fa mihainoa ahy: ny saha dia omeko anao, ary ny zohy izay eo anatiny koa dia omeko anao; eto imason'ny zanaky ny fireneko no anomezako azy ho anao; aleveno ny fatin'ny vadinao.""",Mpampitohy Anarana Matoanteny Tambinteny Mpampiankina Mpanoritra Anarana Mpanoritra Anarana Kianteny Matoanteny Tambinteny Mpanoritra Anarana Anarana Anarana Tambinteny Tambinteny Mpanoritra Anarana Mpanoritra Anarana Kianteny Mpisolo Mpamaritra Matoanteny Tambinteny Tambinteny Anarana Mpanoritra Anarana Kianteny Matoanteny Tambinteny Tambinteny Anarana Tambinteny Matoanteny Mpisolo Mpanoritra Anarana Kianteny Matoanteny Mpisolo Mpampitohy Mpanoritra Anarana Mpisolo Tambinteny Tambinteny Kianteny Kianteny Matoanteny Mpisolo Tambinteny Tambinteny Mpanoritra Anarana Mpanoritra Anarana Kianteny Matoanteny Mpisolo Kianteny Mpisolo Matoanteny Mpanoritra Anarana Mpanoritra Anarana  
"""Ary niankohoka teo anatrehan'ny olona tompon-tany Abrahama, dia niteny tamin'i Efrona teo anatrehan'ny olona tompon-tany ka nanao hoe: Kanefa raha mba hihaino ahy ihany ianao, dia homeko ny vidin'ny saha; raiso amiko izany, dia haleviko ao ny fatin'ny vadiko.""",Mpampitohy Matoanteny Tambinteny Tambinteny Mpanoritra Anarana Anarana Anarana Anarana Kianteny Matoanteny Mpampiankina Mpanoritra Anarana Tambinteny Tambinteny Mpanoritra Anarana Anarana Anarana Kianteny Matoanteny Tambinteny Mpampitohy Mpampitohy Kianteny Matoanteny Mpisolo Tambinteny Mpisolo Kianteny Matoanteny Mpanoritra Anarana Mpanoritra Anarana Matoanteny Mpampiankina Mpisolo Kianteny Matoanteny Tambinteny Mpanoritra Anarana Mpanoritra Anarana
"""Ary Efrona dia namaly an'i Abrahama ka nanao taminy hoe:Tompokolahy, mihainoa ahy: tany tokony ho lafo sekely volafotsy efa-jato, inona moa izany amintsika roa lahy?""",Mpampitohy Anarana Kianteny Matoanteny Tambinteny Mpanoritra Anarana Kianteny Matoanteny Mpampiankina Tambinteny Anarana Matoanteny Mpisolo Tambinteny Tambinteny Kianteny Mpamaritra Anarana Anarana Mpamaritra Mpamaritra Mpisolo Kianteny Mpisolo Mpampiankina Mpamaritra Anarana
"""Fa aleveno ny fatin'ny vadinao.""",Tambinteny Matoanteny Mpanoritra Anarana Mpanoritra Anarana
"""Dia neken'i Abrahama ny tenin'i Efrona, ka nolanjainy ho azy ny vola izay efa voalazany teo anatrehan'ny taranak'i Heta, dia sekely volafotsy efa-jato lanin'ny mpivarotra.""",Mpampitohy Matoanteny Mpanoritra Anarana Mpanoritra Anarana Mpanoritra Anarana Kianteny Matoanteny Kianteny Mpisolo Mpanoritra Anarana Mpisolo Tambinteny Matoanteny Tambinteny Tambinteny Mpanoritra Anarana Mpanoritra Anarana Kianteny Anarana Anarana Mpamaritra Mpamaritra Mpamaritra Mpanoritra Anarana
"""Ary ny sahan'i Efrona, ilay teo Makpela, izay tandrifin'i Mamre, dia ny saha sy ny zohy izay teo anatiny mbamin'ny hazo rehetra izay teo anatiny, izay teo amin'ny sisiny rehetra manodidina, dia natao varo-maty tamini'i Abrahama ho fananana, teo imason'ny taranak'i Heta, dia izay rehetra niditra teo ambavahadin'ny tanànany.""",Mpampitohy Mpanoritra Anarana Mpanoritra Anarana Mpanoritra Tambinteny Anarana Mpisolo Anarana Mpanoritra Anarana Kianteny Mpanoritra Anarana Mpampitohy Mpanoritra Anarana Mpisolo Tambinteny Tambinteny Mpampiankina Mpanoritra Anarana Mpamaritra Mpisolo Tambinteny Tambinteny Mpisolo Tambinteny Mpampiankina Mpanoritra Anarana Mpamaritra Mpamaritra Kianteny Matoanteny Anarana Matoanteny Mpampiankina Mpanoritra Anarana Kianteny Anarana Tambinteny Tambinteny Mpanoritra Anarana Mpanoritra Anarana Kianteny Mpisolo Tambinteny Matoanteny Tambinteny Anarana Mpanoritra Anarana
"""Ary rehefa afaka izany, Abrahama dia nandevina an'i Saraha vadiny tao amin'ny zohy tao amin'ny saha Makpela tandrifin'i Mamre (Hebrona izany), ao amin'ny tany Kanana;ka ny saha mbamin'ny zohy izay ao anatiny dia nataon'ny taranak'i Heta varo-maty tamin'i Abrahama ho tany fandevenana.""",Mpampitohy Tambinteny Matoanteny Mpisolo Anarana Kianteny Matoanteny Tambinteny Mpanoritra Anarana Anarana Tambinteny Mpampiankina Mpanoritra Anarana Tambinteny Mpampiankina Mpanoritra Anarana Anarana Tambinteny Mpanoritra Anarana Anarana Mpisolo Tambinteny Mpampiankina Mpanoritra Anarana Anarana Kianteny Mpanoritra Anarana Mpampiankina Mpanoritra Anarana Mpisolo Tambinteny Tambinteny Kianteny Matoanteny Mpanoritra Anarana Mpanoritra Anarana Anarana Matoanteny Mpampiankina Mpanoritra Anarana Kianteny Tambinteny Anarana
"""Ka ny saha mbamin'ny zohy izay ao anatiny dia nataon'ny taranak'i Heta varo-maty tamin'i Abrahama ho tany fandevenana.""",Kianteny Mpanoritra Anarana Mpampiankina Mpanoritra Anarana Mpisolo Tambinteny Tambinteny Kianteny Matoanteny Mpanoritra Anarana Mpanoritra Anarana Anarana Matoanteny Tambinteny Mpanoritra Anarana Kianteny Tambinteny Anarana
"""Ary Abrahama dia efa zokiolona sady nandroso fahanterana; ary Jehovah efa nitahy an'i Abrahama tamin'ny zavatra rehetra.""",Mpampitohy Anarana Kianteny Tambinteny Anarana Mpampitohy Matoanteny Anarana Mpampitohy Anarana Tambinteny Matoanteny Tambinteny Mpanoritra Anarana Mpampiankina Mpanoritra Anarana Mpamaritra
"""Ary hoy Abrahama tamin'ilay lehiben'ny mpanompony tao an-tranony, izay mpanapaka ny nananany rehetra: Mba ataovy ato ambanin'ny feko ny tananao; fa hampianianiko amin'i Jehovah, Andriamanitry ny lanitra sy ny tany, ianao, fa tsy haka vady ho an'ny zanako avy amin'ny zanakavavin'ny Kananita izay iraisako monina ianao; fa any amin'ny tanin-drazako sy amin'ny havako no halehanao haka vady ho an'Isaka zanako.""",Mpampitohy Mpamaritra Anarana Mpampiankina Mpanoritra Mpamaritra Mpanoritra Anarana Tambinteny Tambinteny Anarana Mpisolo Anarana Mpanoritra Anarana Mpamaritra Kianteny Matoanteny Tambinteny Tambinteny Mpanoritra Anarana Mpanoritra Anarana Tambinteny Matoanteny Mpampitohy Mpanoritra Anarana Anarana Mpanoritra Anarana Mpampitohy Mpanoritra Anarana Mpisolo Tambinteny Tambinteny Matoanteny Anarana Kianteny Tambinteny Mpanoritra Anarana Mpamaritra Mpampiankina Mpanoritra Anarana Mpanoritra Anarana Mpisolo Matoanteny Matoanteny Mpisolo Tambinteny Tambinteny Mpampiankina Mpanoritra Anarana Anarana Mpampitohy Mpampiankina Mpanoritra Anarana Kianteny Anarana Matoanteny Anarana Kianteny Tambinteny Anarana Anarana
"""Ary hoy ilay mpanompony taminy: Angamba tsy hety hiaraka amiko ho amin'ity tany ity ny vehivavy; moa tsy maintsy hitondra ny zanakao hiverina ho any amin'ny tany izay nialanao va aho?""",Mpampitohy Mpamaritra Mpanoritra Anarana Mpampiankina Tambinteny Tambinteny Matoanteny Matoanteny Mpisolo Kianteny Mpampiankina Mpisolo Anarana Mpisolo Mpanoritra Anarana Kianteny Kianteny Tambinteny Matoanteny Mpanoritra Anarana Matoanteny Kianteny Tambinteny Mpampiankina Mpanoritra Anarana Mpisolo Matoanteny Kianteny Mpisolo
"""Ary hoy Abrahama taminy: Tandremo mba tsy ho entinao miverina any ny zanako.""",Mpampitohy Mpamaritra Anarana Mpampiankina Matoanteny Kianteny Tambinteny Kianteny Matoanteny Matoanteny Tambinteny Mpanoritra Anarana
"""Jehovah, Andriamanitry ny lanitra, Izay naka ahy niala tamin'ny tranon'ny raiko sy tamin'ny tany nahaterahako, sady niteny tamiko sy nianiana tamiko hoe: Ny taranakao no homeko ity tany ity, dia Izy no haniraka Ilay Anjeliny eo alohanao, ka any no hakanao vady ho an'ny zanako.""",Anarana Anarana Mpanoritra Anarana Mpisolo Matoanteny Mpanoritra Matoanteny Mpampiankina Mpanoritra Anarana Mpanoritra Anarana Mpampitohy Mpampiankina Mpanoritra Anarana Matoanteny Mpampitohy Matoanteny Mpampiankina Mpampitohy Matoanteny Mpampiankina Tambinteny Mpanoritra Anarana Kianteny Matoanteny Mpisolo Anarana Mpisolo Kianteny Mpisolo Kianteny Matoanteny Mpanoritra Anarana Tambinteny Tambinteny Kianteny Tambinteny Kianteny Matoanteny Anarana Kianteny Tambinteny Mpanoritra Anarana
"""Ary raha tsy hety hiaraka aminao ny vehivavy, dia ho afaka amin'izao fampianianako anao izao ianao; fa izao ihany: aza entinao miverina any mihitsy ny zanako""",Mpampitohy Mpampitohy Tambinteny Matoanteny Matoanteny Mpampiankina Mpanoritra Anarana Kianteny Kianteny Matoanteny Mpampiankina Mpisolo Anarana Mpisolo Mpisolo Mpisolo Tambinteny Mpisolo Tambinteny Tambinteny Matoanteny Matoanteny Tambinteny Tambinteny Mpanoritra Anarana
"""Ary nataon'ilay mpanompo tambanin'ny fen'i Abrahama tompony ny tanany, ka nianiana taminy ny amin'izany zavatra izany izy.""",Mpampitohy Matoanteny Mpanoritra Anarana Tambinteny Mpanoritra Anarana Mpanoritra Anarana Anarana Mpanoritra Anarana Kianteny Matoanteny Mpampiankina Mpanoritra Mpampiankina Mpisolo Anarana Mpisolo Mpisolo
"""Ary ilay mpanompo naka rameva folo tamin'ny ramevan'ny tompony ka lasa, ary izay zava-tsoa nananan'ny tompony dia samy nitondrany avokoa; dia nandeha izy ka nankany Mesopotamia ho any an-tanànan'i Nahora.""",Mpampitohy Mpanoritra Anarana Matoanteny Anarana Mpamaritra Mpampiankina Mpanoritra Anarana Mpanoritra Anarana Kianteny Mpamaritra Mpampitohy Mpisolo Anarana Anarana Matoanteny Mpanoritra Anarana Kianteny Mpisolo Matoanteny Kianteny Kianteny Matoanteny Mpisolo Kianteny Matoanteny Anarana Kianteny Tambinteny Tambinteny Anarana Mpanoritra Anarana
"""Ary nampandohalehiny teo ivelan'ny tanàna tanilan'ny lavaka fantsakan-drano ny rameva, rehefa harivariva ny andro, dia tamin'ilay fandehanan'ny vehivavy mpantsaka iny.""",Mpampitohy Matoanteny Tambinteny Tambinteny Mpanoritra Anarana Tambinteny Mpanoritra Mpamaritra Mpamaritra Anarana Mpanoritra Anarana Tambinteny Anarana Mpanoritra Anarana Kianteny Mpampiankina Mpanoritra Anarana Mpanoritra Anarana Anarana Mpisolo 
"""Dia hoy izy: Jehovah ô, Andriamanitr'i Abrahama tompoko, ambino aho anio, ary asio soa Abrahama tompoko.""",Mpampitohy Mpamaritra Mpisolo Anarana Tenim-piotanana Anarana Mpanoritra Anarana Anarana Matoanteny Mpisolo Tambinteny Mpampitohy Matoanteny Mpamaritra Anarana Anarana
"""Indro, mijanona eto anilan'ny fantsakana aho; ary ny zanakavavin'ny mponina ao an-tanàna mivoaka hantsaka rano; koa izay zazavavy hilazako hoe: Mba areno kely ny sininao hisotroako, ka hamaly hoe izy: Misotroa, sady hampisotro ny ramevanao koa aho : dia izy ihany no aoka ho voatendrinao ho an'Isaka mpanomponao; ary izany no hahafantarako fa nasianao soa ny tompoko.""",Tambinteny Matoanteny Tambinteny Tambinteny Mpanoritra Anarana Mpisolo Mpampitohy Mpanoritra Anarana Mpanoritra Anarana Tambinteny Tambinteny Anarana Matoanteny Anarana Anarana Kianteny Mpisolo Anarana Matoanteny Tambinteny Kianteny Matoanteny Mpamaritra Mpanoritra Anarana Matoanteny Kianteny Matoanteny Tambinteny Mpisolo Matoanteny Mpampitohy Matoanteny Mpanoritra Anarana Kianteny Anarana Kianteny Mpisolo Tambinteny Kianteny Tenim-piotanana Kianteny Matoanteny Kianteny Tambinteny Anarana Anarana Mpampitohy Mpisolo Kianteny Matoanteny Kianteny Matoanteny Mpamaritra Mpanoritra Anarana
"""Ary raha tsy mbola nitsaha-niteny izy, dia, indro, tamy Rebeka, izay naterak'i Betoela, zanakalahin'i Milka, vadin'i Nahpra, rahalahin'i Abrahama, nilanja ny sininy teny an-tsorony.""",Mpampitohy Mpampitohy Tambinteny Tambinteny Matoanteny Matoanteny Mpisolo Kianteny Tambinteny Mpampiankina Anarana Mpisolo Matoanteny Mpanoritra Anarana Anarana Mpanoritra Anarana Anarana Mpanoritra Anarana Anarana Mpanoritra Anarana Matoanteny Mpanoritra Anarana Tambinteny Tambinteny Anarana
"""Ary ilay zazavavy dia tsara tarehy indrindra sady virijina, ka tsy mbola nisy lehilahy nahalala azy; ary nidina nankeo amin'ny fantsakana izy ka nameno ny sininy, dia niakatra.""",Mpampitohy Mpanoritra Anarana Kianteny Mpamaritra Anarana Tambinteny Mpampitohy Anarana Kianteny Tambinteny Tambinteny Matoanteny Anarana Matoanteny Mpisolo Mpampitohy Matoanteny Matoanteny Mpampiankina Mpanoritra Anarana Mpisolo Kianteny Matoanteny Mpanoritra Anarana Kianteny Matoanteny
"""Ary ilay mpanompo dia nihazakazaka nitsena azy ka nanao taminy hoe: Mba ampisotroy rano kely avy amin'ny sininao aho.""",Mpampitohy Mpanoritra Anarana Kianteny Matoanteny Matoanteny Mpisolo Kianteny Matoanteny Mpampiankina Tambinteny Kianteny Matoanteny Anarana Mpamaritra Mpamaritra Mpampiankina Mpanoritra Anarana Mpisolo
"""Ary hoy razazavavy: Misotroa, tompokolahy; dia nampidininy faingana ny sininy ho eo an-tànany, ka nampisotroiny ralehilahy.""",Mpampitohy Tambinteny Anarana Matoanteny Anarana Kianteny Matoanteny Mpamaritra Mpanoritra Anarana Kianteny Kianteny Tambinteny Anarana Kianteny Matoanteny Anarana
"""Ary rehefa nampisotro azy izy, dia hoy koa izy: Ny ramevanao koa andeha hantsakako hosotroiny ambara-pahatapiny misotro.""",Mpampitohy Mpampitohy Matoanteny Mpisolo Mpisolo Kianteny Mpamaritra Kianteny Mpisolo Mpanoritra Anarana Kianteny Matoanteny Matoanteny Matoanteny Matoanteny Matoanteny Matoanteny
"""Ary dia naidiny faingana ny rano teo an-tsininy ho eo amin'ny tavy fisotroana, dia nihazakazaka indray izy nankeo amin'ny lavaka fantsakana hantsaka; ary nantsaka ho an'ny ramevany rehetra izy.""",Mpampitohy Kianteny Matoanteny Mpamaritra Mpanoritra Anarana Tambinteny Tambinteny Anarana Kianteny Kianteny Mpampiankina Mpanoritra Anarana Anarana Kianteny Matoanteny Tambinteny Mpisolo Matoanteny Mpampiankina Mpanoritra Anarana Anarana Anarana Mpampitohy Matoanteny Kianteny Tambinteny Mpanoritra Anarana Mpamaritra Mpisolo
"""Ary ralehilahy nandinika azy tsara sady nangina, mba hahafantarany na efa nambinin'i Jehovah ny nalehany, na tsia.""",Mpampitohy Anarana Matoanteny Mpisolo Mpamaritra Mpampitohy Matoanteny Kianteny Matoanteny Kianteny Tambinteny Matoanteny Mpanoritra Anarana Mpanoritra Anarana Kianteny Tambinteny
