Fehezanteny,Sokajinteny
"""Tamin'ny voalohany Andriamanitra nahary ny lanitra sy ny tany.""",Mpampiankina Mpanoritra Tambinteny Anarana Matoanteny Mpanoritra Anarana Mpampitohy Mpanoritra Anarana
"""Ary ny tany dia tsy nisy endrika sady foana; ary aizina no tambonin'ny lalina.""",Mpampitohy Mpanoritra Anarana Matoanteny Tambinteny Matoanteny Anarana Mpampitohy Mpamaritra Mpampitohy Matoanteny Kianteny Tambinteny Mpanoritra Mpamaritra 
"""Ary ny fanahin'Andriamanitra nanomba tambonin'ny rano.""",Mpampitohy Mpanoritra Anarana Anarana Matoanteny Mpamaritra Mpanoritra Anarana
"""Ary Andriamanitra nanao hoe: Misia mazava; dia nisy mazava.""",Mpampitohy Anarana Matoanteny Tambinteny Matoanteny Anarana Mpampitohy Matoanteny Anarana
"""Ary hitan'Andriamanitra fa tsara ny mazava; ary nampisarahin'Andriamanitra ny mazava sy ny maizina.""",Mpampitohy Matoanteny Anarana Tambinteny Mpamaritra Mpanoritra Anarana Mpampitohy Matoanteny Anarana Mpanoritra Anarana Mpampitohy Mpanoritra Anarana 
"""Ary Andriamanitra nanao ny mazava hoe andro; ary ny maizina nataony hoe alina.""",Mpampitohy Anarana  Matoanteny Mpanoritra Anarana Tambinteny Anarana Mpampitohy Mpanoritra Anarana Matoanteny Tambinteny Anarana
"""Dia nisy hariva, ary nisy maraina, andro voalohany izany.""",Mpampitohy Matoanteny Anarana Mpampitohy Matoanteny Anarana Anarana Tambinteny Mpisolo 
"""Ary Andriamanitra nanao hoe: Misia habakabaka eo anelanelan'ny rano; ary aoka hampisaraka ny rano amin'ny rano izy.""",Mpampitohy Anarana Matoanteny Tambinteny Matoanteny Anarana Tambinteny Tambinteny Mpanoritra Anarana Mpampitohy Tenim-piotanana Matoanteny Mpanoritra Anarana Mpampiankina Mpanoritra Anarana Mpisolo 
"""Ary Andriamanitra nanao ny habakabakaka ka nampisaraka ny rano ambanin'ny habakabaka tamin'ny rano ambonin'ny habakabaka; dia nisy izany.""",Mpampitohy Anarana Matoanteny Mpanoritra Anarana Mpampitohy Matoanteny Mpanoritra Anarana Mpampiankina Mpanoritra Anarana Mpampiankina Mpanoritra Anarana Mpampiankina Mpanoritra Anarana Mpampitohy Matoanteny Mpisolo
"""Ary Andriamanitra nanao ny habakabaka hoe lanitra.""",Mpampitohy Anarana Matoanteny Mpanoritra Anarana Tambinteny Anarana
"""Dia nisy hariva, ary nisy maraina, andro faharoa izany.""",Mpampitohy Matoanteny Anarana Mpampitohy Matoanteny Anarana Anarana Tambinteny Mpisolo 
"""Ary Andriamanitra nanao hoe : Aoka hiangona ny rano eny ambanin'ny lanitra ho eo amin'ny fitoerana iray, ary aoka hiseho ny maina; dia nisy izany.""",Mpampitohy Anarana Matoanteny Tambinteny Tenim-piotanana Matoanteny Mpanoritra Anarana Tambinteny Mpampiankina Mpanoritra Anarana Kianteny Tambinteny Mpampiankina Mpanoritra Anarana Mpamaritra Mpampitohy Tenim-piotanana Matoanteny Mpanoritra Anarana Mpampitohy Matoanteny Mpisolo
"""Ary Andriamanitra nanao ny maina hoe tany; ary ny rano tafangona nataony hoe ranomasina.""",Mpampitohy Anarana Matoanteny Mpanoritra Mpamaritra Tambinteny Anarana Mpampitohy Mpanoritra Anarana Matoanteny Matoanteny Tambinteny Anarana
"""Ary hitan'Andriamanitra fa tsara izany.""",Mpampitohy Matoanteny Anarana Tambinteny Mpamaritra Mpisolo
"""Ary Andriamanitra nanao hoe: Aoka ny tany haniry ahitra sy anana mamoa ary hazo fihinam-boa izay mamoa, samy araka ny karazany avy, ka manam-boa ao aminy, eny ambonin'ny tany; dia nisy izany.""",Mpampitohy Anarana Matoanteny Tambinteny Tenim-piotanana Mpanoritra Anarana Matoanteny Anarana Mpampitohy Anarana Matoanteny Mpampitohy Anarana Matoanteny Anarana Tambinteny Matoanteny Mpisolo Mpampiankina Mpanoritra Anarana Mpamaritra Kianteny Matoanteny Anarana Tambinteny Mpampiankina Tambinteny Tambinteny Mpanoritra Anarana Mpampitohy Matoanteny Mpisolo
"""Ary ny tany naniry ahitra sy anana mamoa samy araka ny karazany avy, ary hazo mamoa izay manam-boa ao aminy, samy araka ny karazany avy.""",Mpampitohy Mpanoritra Anarana Matoanteny Anarana Mpampitohy Anarana Matoanteny Mpisolo Mpampiankina Mpanoritra Anarana Mpamaritra Mpampitohy Anarana Matoanteny Mpisolo Matoanteny Anarana Tambinteny Mpampiankina Mpisolo Mpampiankina Mpanoritra Anarana Mpamaritra
"""Ary hitan'Andriamanitra fa tsara izany.""",Mpampitohy Matoanteny Anarana Tambinteny Mpamaritra Mpisolo
"""Dia nisy hariva, ary nisy maraina, andro fahatelo izany.""",Mpampitohy Matoanteny Anarana Mpampitohy Matoanteny Anarana Anarana Tambinteny Mpisolo
"""Ary Andriamanitra nanao hoe: Misia fahazavana eny amin'ny habakabaky ny lanitra hampisaraka ny andro sy ny alina; ary aoka ho famantarana sy ho fotoana ary ho andro sy taona ireo.""",Mpampitohy Anarana Matoanteny Tambinteny Matoanteny Anarana Tambinteny Mpampiankina Mpanoritra Anarana Mpanoritra Anarana Matoanteny Mpanoritra Anarana Mpampitohy Mpanoritra Anarana Mpampitohy Tenim-piotanana Kianteny Anarana Mpampitohy Kianteny Anarana Mpampitohy Kianteny Anarana Mpampitohy Anarana Mpisolo 
"""Ary aoka ho fanazavana eny amin'ny habakabaky ny lanitra izy hanazava eny ambonin'ny tany; dia nisy izany.""",Mpampitohy Tenim-piotanana Kianteny Anarana Tambinteny Mpampiankina Mpanoritra Anarana Mpanoritra Anarana Mpisolo Matoanteny Tambinteny Tambinteny Mpanoritra Anarana Mpampitohy Matoanteny Mpisolo  
"""Ary Andriamanitra nanao ny fanazavana roa lehibe, dia ny fanazavana lehibe ho mpanapaka ny andro ary ny fanazavana kely ho mpanapaka ny alina sy ny kintana.""",Mpampitohy Anarana Matoanteny Mpanoritra Anarana Mpamaritra Mpamaritra Mpampitohy Mpanoritra Anarana Mpamaritra Kianteny Anarana Mpanoritra Anarana Mpampitohy Mpanoritra Anarana Mpamaritra Kianteny Anarana Mpanoritra Anarana Mpampitohy Mpanoritra Anarana
"""Ary Andriamanitra nametraka azy teny amin'ny habakabaky ny lanitra hanazava eny ambonin'ny tany, sy ho mpanapaka ny andro sy ny alina, ary hampisaraka ny mazava sy ny maizina.""",Mpanoritra Anarana Matoanteny Mpisolo Tambinteny Mpampiankina Mpanoritra Anarana Mpanoritra Anarana Matoanteny Tambinteny Tambinteny Mpanoritra Anarana Mpampitohy Tambinteny Anarana Mpanoritra Anarana Mpampitohy Mpanoritra Anarana Mpampitohy Matoanteny Mpanoritra Matoanteny Mpampitohy Mpanoritra Anarana
"""Ary hitan'Andriamanitra fa tsara izany.""",Mpampitohy Matoanteny Anarana Tambinteny Mpamaritra Mpisolo
"""Dia nisy hariva, ary nisy maraina, andro fahefatra izany.""",Mpampitohy Matoanteny Anarana Mpampitohy Matoanteny Anarana Anarana Tambinteny Mpisolo
"""Ary Andriamanitra nanao hoe: Aoka ny rano ho be zava-manan'aina; ary aoka hisy vorona hanidina ambonin'ny tany eny amin'ny habakabaky ny lanitra.""",Mpampitohy Anarana Matoanteny Tambinteny Tenim-piotanana Mpanoritra Anarana Kianteny Mpamaritra Anarana Matoanteny Anarana Mpampitohy Tenim-piotanana Matoanteny Anarana Matoanteny Tambinteny Mpanoritra Anarana Tambinteny Tambinteny Mpanoritra Anarana Mpanoritra Anarana
"""Ary Andriamanitra nahary ny biby vaventy anaty rano sy ny zava-manan'aina mihetsiketsika rehetra, izay efa betsaka ao amin'ny rano, samy araka ny karazany avy, ary ny voro-manidina rehetra, samy araka ny karazany avy.""",Mpampitohy Anarana Matoanteny Mpanoritra Anarana Mpamaritra Tambinteny Anarana Mpampitohy Mpanoritra Anarana Matoanteny Anarana Matoanteny Mpamaritra Mpisolo Tambinteny Mpamaritra Tambinteny Mpampiankina Mpanoritra Anarana Mpisolo Mpampiankina Mpanoritra Anarana Mpamaritra Mpampitohy Mpanoritra Anarana Matoanteny Mpamaritra Mpisolo Mpampiankina Mpanoritra Anarana Mpamaritra  
"""Ary hitan'Andriamanitra fa tsara izany.""",Mpampitohy Matoanteny Anarana Tambinteny Mpamaritra Mpisolo
"""Ary Andriamanitra nitso-drano azy hoe: Maroa anaka sy mihabetsaha ary mamenoa ny rano ao amin'ny ranomasina; ary aoka ny vorona hihamaro eny ambonin'ny tany.""",Mpampitohy Anarana Matoanteny Anarana Mpisolo Tambinteny Mpamaritra Anarana Mpampitohy Matoanteny Mpampitohy Matoanteny Mpanoritra Anarana Tambinteny Tambinteny Mpanoritra Anarana Mpampitohy Tenim-piotanana Mpanoritra Anarana Matoanteny Tambinteny Tambinteny Mpanoritra Anarana
"""Dia nisy ny hariva, ary nisy maraina, andro fahadimy izany.""",Mpampitohy Matoanteny Mpanoritra Anarana Mpampitohy Matoanteny Anarana Anarana Tambinteny Mpisolo
"""Ary Andriamanitra nanao hoe: Aoka ny tany hamoaka zava-manan'aina samy araka ny karazany avy, dia biby fiompy sy biby mandady sy mikisaka ary bibi-dia, samy araka ny karazany avy; dia nisy izany.""",Mpampitohy Anarana Matoanteny Tambinteny Tenim-piotanana Mpanoritra Anarana Matoanteny Anarana Matoanteny Anarana Mpisolo Mpampiankina Mpanoritra Anarana Mpamaritra Mpampitohy Anarana Anarana Mpampitohy Anarana Matoanteny Mpampitohy Matoanteny Mpampitohy Anarana Anarana Mpisolo Mpampiankina Mpanoritra Anarana Mpamaritra Mpampitohy Matoanteny Mpisolo
"""Ary Andriamanitra nanao ny bibi-dia, samy araka ny karazany avy, sy ny biby fiompy, samy araka ny karazany avy, ary ny biby rehetra izay mandady na mikisaka amin'ny tany, samy araka ny karazany avy.""",Mpampitohy Anarana Matoanteny Mpanoritra Anarana Anarana Mpisolo Mpampiankina Mpanoritra Anarana Mpamaritra Mpampitohy Mpanoritra Anarana Anarana Mpisolo Mpampiankina Mpanoritra Anarana Mpamaritra Mpampitohy Mpanoritra Anarana Mpamaritra Mpisolo Matoanteny Kianteny Matoanteny Mpampiankina Mpanoritra Anarana Mpisolo Mpampiankina Mpanoritra Anarana Mpamaritra
"""Ary hitan'Andriamanitra fa tsara izany.""",Mpampitohy Matoanteny Anarana Tambinteny Mpamaritra Mpisolo
"""Ary Andriamanitra nanao hoe: Andeha Isika hamorona olona tahaka ny endritsika, araka ny tarehintsika ; ary aoka izy hanjaka amin'ny hazandrano ao amin'ny ranomasina sy ny voro-manidina sy ny biby fiompy sy ny tany rehetra ary ny biby rehetra izay mandady na mikisaka amin'ny tany.""",Mpampitohy Anarana Matoanteny Tambinteny Matoanteny Mpisolo Matoanteny Anarana Mpamaritra Mpanoritra Anarana Mpampiankina Mpanoritra Anarana Mpampitohy Tenim-piotanana Mpisolo Matoanteny Mpampiankina Mpanoritra Anarana Tambinteny Mpampiankina Mpanoritra Anarana Mpampitohy Mpanoritra Anarana Anarana Mpampitohy Mpanoritra Anarana Anarana Mpampitohy Mpanoritra Anarana Mpamaritra Mpampitohy Mpanoritra Anarana Mpamaritra Mpisolo Matoanteny Kianteny Matoanteny Mpampiankina Mpanoritra Anarana  
"""Ary Andriamanitra nahary ny olona tahaka ny endriny; tahaka ny endrik'Andriamanitra no namoronany azy; lahy sy vavy no namoronany azy.""",Mpampitohy Anarana Matoanteny Mpanoritra Anarana Mpamaritra Mpanoritra Anarana Mpamaritra Mpanoritra Anarana Anarana Kianteny Matoanteny Mpisolo Anarana Mpampitohy Anarana Kianteny Matoanteny Mpisolo
"""Ary Andriamanitra nitso-drano azy hoe: Maroa fara sy mihabetsaha ary mamenoa ny tany, ka mampanompoa azy; ary manjaka amin'ny hazandrano ao amin'ny ranomasina sy ny voro-manidina ary ny biby rehetra izay mihetsiketsika ambonin'ny tany.""",Mpampitohy Anarana Matoanteny Anarana Mpisolo Tambinteny Matoanteny Anarana Mpampitohy Matoanteny Mpampitohy Matoanteny Mpanoritra Anarana Kianteny Matoanteny Mpisolo Mpampitohy Matoanteny Tambinteny Mpanoritra Anarana Tambinteny Tambinteny Mpanoritra Anarana Mpampitohy Mpanoritra Anarana Matoanteny Mpampitohy Mpanoritra Anarana Mpamaritra Mpisolo Matoanteny Tambinteny Mpanoritra Anarana
"""Ary Andriamanitra nanao hoe: Indro, efa nomeko anareo ny anana manintsam-boa rehetra izay ambonin'ny tany rehetra ary ny hazo rehetra izay misy voa sady manintsam-boa; dia ho fihinana anareo ireny.""",Mpampitohy Anarana Matoanteny Tambinteny Tenim-piotanana Tambinteny Matoanteny Mpisolo Mpanoritra Anarana Matoanteny Anarana Mpamaritra Mpisolo Tambinteny Mpanoritra Anarana Mpamaritra Mpampitohy Mpanoritra Anarana Mpamaritra Mpisolo Matoanteny Anarana Mpampitohy Matoanteny Anarana Kianteny Mpampitohy Matoanteny Mpisolo Mpisolo
"""Ary ny amin'ny bibi-dia rehetra sy ny voro-manidina rehetra ary ny zava-manan'aina rehetra izay mandady na mikisaka amin'ny tany, dia efa nomeko azy ny zava-maitso rehetra ho fihinany; dia nisy izany.""",Mpampitohy Mpanoritra Tambinteny Mpanoritra Anarana Anarana Mpamaritra Mpampitohy Mpanoritra Anarana Matoanteny Mpamaritra Mpampitohy Mpanoritra Anarana Matoanteny Anarana Mpamaritra Mpisolo Matoanteny Mpampitohy Matoanteny Tambinteny Mpanoritra Anarana Mpampitohy Tambinteny Matoanteny Mpisolo Mpanoritra Anarana Mpamaritra Mpamaritra Kianteny Matoanteny Mpampitohy Matoanteny Mpisolo
"""Ary hitan'Andriamanitra izay rehetra nataony, ary, indro, tsara indrindra izany.""",Mpampitohy Matoanteny Anarana Mpisolo Mpamaritra Matoanteny Mpampitohy Tenim-piotanana Mpamaritra Tambinteny Mpisolo
"""Dia nisy ny hariva, ary nisy maraina, andro fahenina izany.""",Mpampitohy Matoanteny Mpanoritra Anarana Mpampitohy Matoanteny Anarana Anarana Tambinteny Mpisolo
"""Ary hitan'Andriamanitra izay rehetra nataony, ary, indro, tsara indrindra izany.""",Mpampitohy Matoanteny Anarana Mpisolo Mpamaritra Matoanteny Mpampitohy Tenim-piotanana Mpamaritra Tambinteny Mpisolo
"""Dia nisy ny hariva, ary nisy maraina, andro fahenina izany.""",Mpampitohy Matoanteny Mpanoritra Anarana Mpampitohy Matoanteny Anarana Anarana Tambinteny Mpisolo
"""Dia vita ny lanitra sy ny tany sy izay rehetra ao aminy.""",Mpampitohy Matoanteny Mpanoritra Anarana Mpampitohy Mpanoritra Anarana Mpampitohy Mpisolo Mpamaritra Tambinteny Mpampiankina
"""Ary tamin'ny andro fahafito dia vitan'Andriamanitra ny asa efa nataony; ary dia nitsahatra tamin'ny andro fahafito Izy tamin'ny asany rehetra izay efa nataony.""",Mpampitohy Mpampiankina Mpanoritra Anarana Tambinteny Kianteny Matoanteny Anarana Mpanoritra Anarana Tambinteny Matoanteny Mpampitohy Kianteny Matoanteny Mpampiankina Mpanoritra Anarana Tambinteny Mpisolo Mpampiankina Mpanoritra Anarana Mpamaritra Mpisolo Tambinteny Matoanteny
"""Ary Andriamanitra nitahy ny andro fahafito sy nanamasina azy, satria tamin'izany no nitsaharan'Andriamanitra tamin'ny asany rehetra izay noforoniny tamin'ny nanaovany azy.""",Mpampitohy Anarana Matoanteny Mpanoritra Anarana Tambinteny Mpampitohy Matoanteny Mpisolo Mpampitohy Mpampiankina Mpisolo Kianteny Matoanteny Anarana Mpampiankina Mpanoritra Anarana Mpamaritra Mpisolo Matoanteny Mpampiankina Mpanoritra Matoanteny Mpisolo
"""Ny saha tao Edena, sy ny toetry ny olombelona fony tsy mbola nanota izy.""",Mpanoritra Anarana Tambinteny Anarana Mpampitohy Mpanoritra Anarana Mpanoritra Anarana Mpampitohy Tambinteny Tambinteny Matoanteny Mpisolo 
"""Ary izao no tantaran'ny lanitra sy ny tany tamin'ny namoronana azy, dia tamin'ny nanaovan'i Jehovah Andriamanitra ny tany sy ny lanitra: Ny hazo madinika famboly dia tsy mbola nisy teo amin'ny tany, ary ny anana famboly tsy mbola nisy naniry; fa tsy mbola nampilatsaka ranonorana tambonin'ny tany Jehovah Andriamanitra, ary nisy olona hiasa ny tany; nefa nisy zavona niakatra avy tamin'ny tany ka nandena ny tany rehetra.""",Mpampitohy Mpisolo Kianteny Anarana Mpanoritra Anarana Mpampitohy Mpanoritra Anarana Mpampiankina Mpanoritra Matoanteny Mpisolo Mpampitohy Mpampiankina Mpanoritra Matoanteny Mpanoritra Anarana Anarana Mpanoritra Anarana Mpampitohy Mpanoritra Anarana Mpanoritra Anarana Mpamaritra Anarana Kianteny Tambinteny Tambinteny Matoanteny Tambinteny Mpampiankina Mpanoritra Anarana Mpampitohy Mpanoritra Anarana Anarana Tambinteny Kianteny Matoanteny Matoanteny Tambinteny Tambinteny Kianteny Matoanteny Anarana Mpampiankina Mpanoritra Anarana Anarana Anarana Mpampitohy Matoanteny Anarana Matoanteny Mpanoritra Anarana Mpampitohy Matoanteny Anarana Matoanteny Mpamaritra Mpampiankina Mpanoritra Anarana Kianteny Matoanteny Mpanoritra Anarana Mpamaritra
"""Ary vovo-tany no namoronan'i Jehovah Andriamanitra ny olona, ary nofofoniny fofonaina mahavelona ny vavorony; dia tonga olombelona izy.""",Mpampitohy Anarana Anarana Kianteny Matoanteny Mpanoritra Anarana Anarana Mpanoritra Anarana Mpampitohy Matoanteny Anarana Matoanteny Mpanoritra Anarana Mpampitohy Matoanteny Anarana Mpisolo
"""Ary Jehovah Andriamanitra nanao saha tao Edena tany atsinanana, ka napetrany tao ralehilahy izay noforoniny.""",Mpampitohy Anarana Anarana Matoanteny Anarana Tambinteny Anarana Tambinteny Anarana Kianteny Matoanteny Tambinteny Anarana Mpisolo Matoanteny
"""Ary nampanirin'i Jehovah Andriamanitra teo amin'ny tany ny hazo rehetra izay maha-te-hizaha sady tsara ho fihinana, ary ny hazon'aina teo afovoan'ny saha sy ny hazo fahalalana ny tsara sy ny ratsy.""",Mpampitohy Matoanteny Mpanoritra Anarana Anarana Tambinteny Mpampiankina Mpanoritra Anarana Mpanoritra Anarana Mpamaritra Mpisolo Matoanteny Matoanteny Matoanteny Mpampitohy Mpamaritra Kianteny Matoanteny Mpampitohy Mpanoritra Matoanteny Anarana Tambinteny Tambinteny Mpanoritra Anarana Mpampitohy Mpanoritra Anarana Anarana Mpanoritra Anarana Mpampitohy Mpanoritra Anarana
"""Ary nisy ony nivoaka avy tao Edena handena ny saha; hatreo izy dia nizara ka nisampana efatra: ny anaran'ny voalohany dia Pisona; io no mandeha manodidina ny tany Havila rehetra, izay misy ny volamena; ary tsara ny volamena amin'izany tany izany; any ny bedola sy ny vato beryla.""",Mpampitohy Matoanteny Anarana Matoanteny Mpamaritra Tambinteny Anarana Matoanteny Mpanoritra Anarana Tambinteny Mpisolo Kianteny Matoanteny Kianteny Matoanteny Mpamaritra Mpanoritra Anarana Mpanoritra Tambinteny Kianteny Anarana Mpisolo Kianteny Matoanteny Matoanteny Mpanoritra Anarana Anarana Mpamaritra Mpisolo Matoanteny Mpanoritra Anarana Mpampitohy Mpamaritra Mpanoritra Anarana Mpampiankina Mpanoritra Anarana Mpisolo Tambinteny Mpanoritra Anarana Mpampitohy Mpanoritra Anarana Anarana
"""Ary ny anaran'ny ony faharoa dia Gihona; io no mandeha manodidina ny tany Kosy rehetra.""",Mpampitohy Mpanoritra Anarana Mpanoritra Anarana Tambinteny Kianteny Anarana Mpisolo Kianteny Matoanteny Tambinteny Mpanoritra Anarana Anarana Mpamaritra
"""Ary ny anaran'ny ony fahatelo dia Hidekela; io no mandeha tandrifin'i Asyria.""",Mpampitohy Mpanoritra Anarana Mpanoritra Anarana Tambinteny Kianteny Anarana Mpisolo Kianteny Matoanteny Mpampiankina Mpanoritra Anarana
"""Ary ny ony fahefatra dia Eofrata.""",Mpampitohy Mpanoritra Anarana Tambinteny Kianteny Anarana
"""Ary Jehovah Andriamanitra nitondra an-dralehilahy ka namponina azy tao amin'ny saha Edena hiasa sy hitandrina azy.""",Mpampitohy Anarana Anarana Matoanteny Mpampiankina Anarana Kianteny Matoanteny Mpisolo Tambinteny Mpampiankina Mpanoritra Anarana Anarana Matoanteny Mpampitohy Matoanteny Mpisolo
"""Ary Jehovah Andriamanitra nandidy an-dralehilahy ka nanao hoe: Ny hazo rehetra eo amin'ny saha dia azonao ihinanana ihany; fa ny hazo fahalalana ny tsara sy ny ratsy dia aza ihinanana; fa amin'ny andro izay ihinananao azy dia ho faty tokoa ianao.""",Mpampitohy Anarana Anarana Matoanteny Mpampiankina Anarana Kianteny Matoanteny Tambinteny Mpanoritra Anarana Mpamaritra Tambinteny Mpampiankina Mpanoritra Anarana Kianteny Matoanteny Matoanteny Tambinteny Tambinteny Mpanoritra Anarana Anarana Mpanoritra Anarana Mpampitohy Mpanoritra Anarana Kianteny Kianteny Matoanteny Tambinteny Mpampiankina Mpanoritra Anarana Mpisolo Matoanteny Mpisolo Kianteny Tambinteny Anarana Tambinteny Mpisolo 
"""Ary Jehovah Andriamanitra nanao hoe: Tsy tsara raha irery ralehilahy; dia hanaovako vady sahaza ho azy izy.""",Mpampitohy Anarana Anarana Matoanteny Tambinteny Tambinteny Mpamaritra Mpampitohy Mpamaritra Anarana Kianteny Matoanteny Anarana Mpamaritra Kianteny Mpisolo Mpisolo
"""Ary tany no namoronan'i Jehovah Andriamanitra ny bibi-dia rehetra sy ny voro-manidina rehetra; dia nentiny tany amin-dralehilahy ireny hahitany izay hanononany azy avy; ary izay rehetra nanononan-dralehilahy ny zava-manan'aina rehetra, dia izany no anarany.""",Mpampitohy Tambinteny Kianteny Matoanteny Mpanoritra Anarana Anarana Mpanoritra Anarana Anarana Mpamaritra Mpampitohy Mpanoritra Anarana Mpamaritra Mpamaritra Kianteny Matoanteny Tambinteny Mpampiankina Anarana Mpisolo Matoanteny Mpisolo Matoanteny Mpisolo Mpamaritra Mpampitohy Mpisolo Mpamaritra Matoanteny Anarana Mpanoritra Anarana Anarana Anarana Mpamaritra Mpampitohy Mpisolo Kianteny Anarana
"""Dia nomen-dralehilahy anarana ny biby fiompy rehetra sy ny voro-manidina mbamin'ny bibi-dia rehetra; nefa tsy hita izay vady sahaza ho an-dralehilahy.""",Mpampitohy Matoanteny Anarana Anarana Mpanoritra Anarana Anarana Mpamaritra Mpampitohy Mpanoritra Anarana Mpamaritra Mpampiankina Mpanoritra Anarana Mpamaritra Mpamaritra Mpampitohy Tambinteny Matoanteny Mpisolo Anarana Mpamaritra Kianteny Tambinteny Anarana 
"""Ary Jehovah Andriamanitra nahasondrian-tory an-dralehilahy, ka dia natory izy; dia naka ny taolan-tehezany anankiray Izy ka nanakombona nofo ho solony.""",Mpampitohy Anarana Anarana Matoanteny Anarana Mpampiankina Anarana Kianteny Kianteny Matoanteny Mpisolo Mpampitohy Matoanteny Mpanoritra Anarana Anarana Mpamaritra Mpisolo Kianteny Matoanteny Anarana Kianteny Anarana
"""Ary ny taolan-tehezana izay nalain'i Jehovah Andriamanitra tamin-dralehilahy dia nataony vehivavy ka nentiny tany amin-dralehilahy.""",Mpampitohy Mpanoritra Anarana Anarana Mpisolo Matoanteny Mpanoritra Anarana Anarana Mpampiankina Anarana Mpampitohy Matoanteny Anarana Kianteny Matoanteny Tambinteny Mpampiankina Anarana
"""Ary hoy ralehilahy: Ankehitriny dia taolana avy amin'ny taolako sy nofo avy amin'ny nofoko ity; ity dia hatao hoe vehivavy satria lehilahy no nanalana azy.""",Mpampitohy Mpamaritra Anarana Tambinteny Kianteny Anarana Mpamaritra Mpampiankina Mpanoritra Anarana Mpampitohy Anarana Mpamaritra Mpampiankina Mpanoritra Anarana Mpisolo Mpisolo Kianteny Matoanteny Tambinteny Anarana Mpampitohy Anarana Kianteny Matoanteny Mpisolo 
"""Ary noho izany ny lehilahy dia handao ny rainy sy ny reniny ka hikambana amin'ny vadiny; dia ho nofo iray ihany ireo.""",Mpampitohy Mpampitohy Mpisolo Mpanoritra Anarana Kianteny Matoanteny Mpanoritra Anarana Mpampitohy Mpanoritra Anarana Kianteny Matoanteny Mpampiankina Mpanoritra Anarana Mpampitohy Kianteny Anarana Mpamaritra Tambinteny Mpisolo
"""Ary nitanjaka izy mivady, dia ralehilahy sy ny vadiny, nefa tsy nahalala henatra izy.""",Mpampitohy Matoanteny Mpisolo Matoanteny Mpampitohy Anarana Mpampitohy Mpanoritra Anarana Mpampitohy Tambinteny Matoanteny Anarana Mpisolo
"""Ny nanotan'i Adama sy Eva, sy izay nataon'Andriamanitra taminy.""",Mpanoritra Matoanteny Mpanoritra Anarana Mpampitohy Anarana Mpampitohy Mpisolo Matoanteny Anarana Mpampiankina
"""Ary ny menarana dia fetsy noho ny bibi-dia rehetra izay nataon'i Jehovah Andriamanitra.""",Mpampitohy Mpanoritra Anarana Kianteny Mpamaritra Mpampitohy Mpanoritra Anarana Anarana Mpamaritra Mpisolo Matoanteny Mpanoritra Anarana Anarana
"""Ary hoy izy tamin-dravehivavy: Hanky! efa nataon'Andriamanitra hoe: Aza ihinananareo ny hazo rehetra amin'ny saha?""",Mpampitohy Mpamaritra Mpisolo Mpampiankina Anarana Tenim-piotanana Tambinteny Matoanteny Anarana Tambinteny Kianteny Matoanteny Mpanoritra Anarana Mpamaritra Mpampiankina Mpanoritra Anarana
"""Fa hoy ravehivavy tamin'ny menarana: Ny voan'ny hazo eo amin'ny saha dia azonay ihinanana ihany; fa ny voan'ny hazo eo afovoan'ny saha kosa no efa nataon'Andriamanitra hoe: Aza hihinanareo na tendrenareo izany, fandrao maty ianareo.""",Tambinteny Mpamaritra Anarana Mpampiankina Mpanoritra Anarana Mpanoritra Anarana Mpanoritra Anarana Tambinteny Mpampiankina Mpanoritra Anarana Kianteny Matoanteny Matoanteny Tambinteny Tambinteny Mpanoritra Anarana Mpanoritra Anarana Tambinteny Tambinteny Mpanoritra Anarana Mpampitohy Kianteny Tambinteny Matoanteny Anarana Tambinteny Kianteny Matoanteny Kianteny Matoanteny Mpisolo Mpampitohy Matoanteny Mpisolo  
"""Ary hoy ny menarana tamin-dravehivavy: Tsy ho faty tsy akory ianareo; fa fantatr'Andriamanitra fa na amin'izay andro hihinananareo azy dia hahiratra ny masonareo, ka ho tahaka an'Andriamanitra ianareo, hahalala ny tsara sy ny ratsy.""",Mpampitohy Mpamaritra Mpanoritra Anarana Mpampiankina Anarana Tambinteny Kianteny Anarana Tambinteny Tambinteny Mpisolo Tambinteny Matoanteny Anarana Tambinteny Kianteny Mpampiankina Mpisolo Anarana Matoanteny Mpisolo Kianteny Matoanteny Mpanoritra Anarana Kianteny Kianteny Mpamaritra Mpampiankina Anarana Mpisolo Matoanteny Mpanoritra Anarana Mpampitohy Mpanoritra Anarana 
"""Ary hitan-dravehivavy fa tsara ho fihinana ny hazo sady mahafinaritra ny maso ary hazo mahatsiriritra hampahahendry, dia nanotazany ny voany ka nihinanany; ary nomeny koa ny vadiny; ka dia nihinana izy.""",Mpampitohy Matoanteny Anarana Tambinteny Mpamaritra Kianteny Matoanteny Mpanoritra Anarana Mpampitohy Matoanteny Mpanoritra Anarana Mpampitohy Anarana Matoanteny Matoanteny Mpampitohy Matoanteny Mpanoritra Anarana Kianteny Matoanteny Mpampitohy Matoanteny Tambinteny Mpanoritra Anarana Kianteny Kianteny Matoanteny Mpisolo
"""Dia nahiratra ny mason'izy mivady, ka fantany fa mitanjaka izy; ary nanjaitra ravin'aviavy izy, ka nataony sikina ho azy.""",Mpampitohy Matoanteny Mpanoritra Anarana Mpisolo Anarana Kianteny Matoanteny Tambinteny Matoanteny Mpisolo Mpampitohy Matoanteny Anarana Anarana Mpisolo Kianteny Matoanteny Anarana Kianteny Mpisolo
"""Ary nandre an'i Jehovah Andriamanitra nitsangantsangana teo amin'ny saha izy, rehefa ho hariva ny andro; ary ralehilahy sy ny vadiny niery ny tavan'i Jehovah Andriamanitra tao anaty hazo tao amin'ny saha.""",Mpampitohy Matoanteny Tambinteny Mpanoritra Anarana Anarana Matoanteny Tambinteny Mpampiankina Mpanoritra Anarana Mpisolo Tambinteny Kianteny Anarana Mpanoritra Anarana Mpampitohy Anarana Mpampitohy Mpanoritra Anarana Matoanteny Mpanoritra Anarana Mpanoritra Anarana Anarana Tambinteny Mpampiankina Anarana Tambinteny Mpampiankina Mpanoritra Anarana
"""Ary Jehovah Andriamanitra dia niantso an-dralehilahy ka nanao taminy hoe: Aiza moa ianao?""",Mpampitohy Anarana Anarana Kianteny Matoanteny Mpampiankina Anarana Kianteny Matoanteny Mpampiankina Tambinteny Tambinteny Kianteny Mpisolo
"""Dia hoy izy: Nandre Anao tao amin'ny saha aho; dia natahotra aho, satria mitanjaka, ka dia niery.""",Mpampitohy Mpamaritra Mpisolo Matoanteny Mpisolo Tambinteny Mpampiankina Mpanoritra Anarana Mpisolo Kianteny Matoanteny Mpisolo Mpampitohy Matoanteny Kianteny Kianteny Matoanteny 
