Fehezanteny,Sokajinteny
"""Ary rehefa efatra amby telo-polo taona ny andro niainan'i Ebera, dia niteraka an'i Palega izy.""",Mpampitohy Tambinteny Mpamaritra Anarana Mpamaritra Mpamaritra Anarana Mpanoritra Anarana Matoanteny Mpanoritra Anarana Kianteny Matoanteny Tambinteny Mpanoritra Anarana Mpisolo 
"""Ary ny andro niainan'i Ebera taorian'ny niterahany an'i Palega dia telo-polo amby efa-jato taona; ary niteraka zazalahy sy zazavavy izy.""",Mpampitohy Mpanoritra Anarana Matoanteny Mpanoritra Anarana Tambinteny Mpanoritra Matoanteny Tambinteny Mpanoritra Anarana Kianteny Mpamaritra Mpamaritra Anarana Mpamaritra Mpamaritra Anarana Mpampitohy Matoanteny Anarana Mpampitohy Anarana Mpisolo
"""Ary rehefa telo-polo taona ny andro niainan'i Palega, dia niteraka an-dReo izy, Ary ny andro niainan'i Palega taorian'ny niterahany an-dReo dia sivy amby roan-jato taona; ary niteraka zazalahy sy zazavavy izy.""",Mpampitohy Tambinteny Mpamaritra Mpamaritra Anarana Mpanoritra Anarana Matoanteny Mpanoritra Anarana Kianteny Matoanteny Tambinteny Mpisolo Mpisolo Mpampitohy Mpanoritra Anarana Matoanteny Mpanoritra Anarana Tambinteny Mpanoritra Matoanteny Tambinteny Mpisolo Kianteny Mpamaritra Anarana Mpamaritra Mpamaritra Anarana Mpampitohy Matoanteny Anarana Mpampitohy Anarana Mpisolo
"""Ary rehefa roa amby telo-polo, taona ny andro niainan-dReo, dia niteraka an'i Seroga izy.""",Mpampitohy Tambinteny Mpamaritra Anarana Mpamaritra Mpamaritra Anarana Mpanoritra Anarana Matoanteny Mpisolo Kianteny Matoanteny Tambinteny Mpanoritra Anarana Mpisolo
"""Ary ny andro niainan-dReo taorian'ny niterahany an'i Seroga dia fito amby roan-jato taona; ary niteraka zazalahy sy zazavavy izy.""",Mpampitohy Mpanoritra Anarana Matoanteny Mpisolo Tambinteny Mpanoritra Matoanteny Tambinteny Mpanoritra Anarana Kianteny Mpamaritra Anarana Mpamaritra Mpamaritra Anarana Mpampitohy Matoanteny Anarana Mpampitohy Anarana Mpisolo
"""Ary rehefa telo-polo taona ny andro niainan'i Seroga, dia niteraka an'i Nahora izy, Ary ny andro niainan'i Seroga taorian'ny niterahany an'i Nahora dia roan-jato taona; ary niteraka zazalahy sy zazavavy izy.""",Mpampitohy Tambinteny Mpamaritra Mpamaritra Anarana Mpanoritra Anarana Matoanteny Mpanoritra Anarana Kianteny Matoanteny Tambinteny Mpanoritra Anarana Mpisolo Mpampitohy Mpanoritra Anarana Matoanteny Mpanoritra Anarana Tambinteny Mpanoritra Matoanteny Tambinteny Mpanoritra Anarana Kianteny Mpamaritra Mpamaritra Anarana Mpampitohy Matoanteny Anarana Mpampitohy Anarana Mpisolo
"""Ary rehefa sivy amby roa-polo taona ny andro niainan'i Nahora, dia niteraka an'i Tera izy.""",Mpampitohy Tambinteny Mpamaritra Anarana Mpamaritra Mpamaritra Anarana Mpanoritra Anarana Matoanteny Mpanoritra Anarana Kianteny Matoanteny Tambinteny Mpanoritra Anarana Mpisolo
"""Ary ny andro niainan'i Nahora taorian'ny niterahany an'i Tera dia sivy ambin'ny folo amby zato taona; ary niteraka zazalahy sy zazavavy izy.""",Mpampitohy Mpanoritra Anarana Matoanteny Mpanoritra Anarana Tambinteny Mpanoritra Matoanteny Tambinteny Mpanoritra Anarana Kianteny Mpamaritra Anarana Mpanoritra Mpamaritra Anarana Mpamaritra Anarana Mpampitohy Matoanteny Anarana Mpampitohy Anarana Mpisolo
"""Ary rehefa fito-polo taona ny andro niainan'i Tera, dia niteraka an'i Abrama sy Nahora ary Harana izy: Ary izao no taranak'i Tera: Tera niteraka an'i Abrama sy Nahora ary Harana; ary Harana niteraka an'i Lota.""", Mpampitohy Tambinteny Mpamaritra Mpamaritra Anarana Mpanoritra Anarana Matoanteny Mpanoritra Anarana Kianteny Matoanteny Tambinteny Mpanoritra Anarana Mpampitohy Anarana Mpampitohy Anarana Mpisolo Mpampitohy Mpisolo Kianteny Anarana Mpanoritra Anarana Anarana Matoanteny Tambinteny Mpanoritra Anarana Mpampitohy Anarana Mpampitohy Anarana Mpampitohy Anarana Matoanteny Tambinteny Mpanoritra Anarana
"""Ary maty Harana, raha mbola teo anatrehan'i Tera rainy tany amin'ny tany nahaterahany, dia tao Oran'ny Kaldeana.""",Mpampitohy Matoanteny Anarana Mpampitohy Tambinteny Tambinteny Tambinteny Mpanoritra Anarana Anarana Tambinteny Mpampiankina Mpanoritra Anarana Matoanteny Kianteny Tambinteny Anarana Mpanoritra Anarana
"""Ary Abrama sy Nahora dia samy naka vady ho azy: ny anaran'ny vadin'i Abrama dia Saray; ary ny anaran'ny vadin'i Nahora dia Milka, zanakavavin'i Harana, rain'i Milka sy rain'Iska.""",Mpampitohy Anarana Mpampitohy Anarana Kianteny Mpisolo Matoanteny Anarana Kianteny Mpisolo Mpanoritra Anarana Mpanoritra Anarana Mpanoritra Anarana Kianteny Anarana Mpampitohy Mpanoritra Anarana Mpanoritra Anarana Mpanoritra Anarana Kianteny Anarana Anarana Mpanoritra Anarana Anarana Mpanoritra Anarana Mpampitohy Anarana Anarana
"""Ary momba Saray; tsy nanan-janaka izy.""",Mpampitohy Matoanteny Anarana Tambinteny Matoanteny Anarana Mpisolo
"""Ary Tera nitondra an'i Abrama zanany sy Lota zafiny, zanak'i Harana, ary Saray vinantoni-vavy, vadin'i Abrama zanany; dia niaraka taminy ireo ka niala tao Oran'ny Kaldeana hankany amin'ny tany Kanana; dia tonga tao Harana izy ka nonina tao.""",Mpampitohy Anarana Matoanteny Tambinteny Mpanoritra Anarana Anarana Mpampitohy Anarana Anarana Anarana Mpanoritra Anarana Mpampitohy Anarana Anarana Anarana Anarana Mpanoritra Anarana Anarana Kianteny Matoanteny Mpampiankina Mpisolo Kianteny Matoanteny Tambinteny Anarana Mpanoritra Anarana Matoanteny Mpampiankina Mpanoritra Anarana Anarana Kianteny Matoanteny Tambinteny Anarana Mpisolo Kianteny Matoanteny Tambinteny
"""Ary dimy amby roan-jato taona ny andro niainan'i Tera; dia maty tao Harana izy.""",Mpampitohy Mpamaritra Anarana Mpamaritra Mpamaritra Anarana Mpanoritra Anarana Matoanteny Mpanoritra Anarana Kianteny Matoanteny Tambinteny Anarana Mpisolo
"""Ary hoy Jehovah tamin'i Abrama: Mandehana miala amin'ny taninao sy ny havanao ary ny tranon'ny rainao hankany amin'ny tany izay hasehoko anao; dia hahatonga anao ho firenena lehibe Aho sady hitahy anao sy hahalehibe ny anaranao; ary ho fitahiana tokoa ianao; ary hitahy izay manisy soa anao Aho, fa hanozona izay manozona anao; ary aminao no hitahiana ny firenena rehetra ambonin'ny tany.""",Mpampitohy Mpamaritra Anarana Mpampiankina Mpanoritra Anarana Matoanteny Matoanteny Mpampiankina Mpanoritra Anarana Mpampitohy Mpanoritra Anarana Mpampitohy Mpanoritra Anarana Mpanoritra Anarana Matoanteny Mpampiankina Mpanoritra Anarana Mpisolo Matoanteny Mpisolo Kianteny Matoanteny Mpisolo Kianteny Anarana Mpamaritra Mpisolo Mpampitohy Matoanteny Mpisolo Mpampitohy Matoanteny Mpanoritra Anarana Mpampitohy Kianteny Anarana Tambinteny Mpisolo Mpampitohy Matoanteny Mpisolo Matoanteny Mpamaritra Mpisolo Mpisolo Tambinteny Matoanteny Mpisolo Matoanteny Mpisolo Mpampitohy Mpisolo Kianteny Matoanteny Mpanoritra Anarana Mpamaritra Tambinteny Mpanoritra Anarana
"""Dia nandeha Abrama araka izay efa nolazain'i Jehovah taminy, ary Lota koa mba niaraka taminy.""",Mpampitohy Matoanteny Anarana Mpampiankina Mpisolo Tambinteny Matoanteny Mpanoritra Anarana Mpampiankina Mpampitohy Anarana Mpampitohy Kianteny Matoanteny Mpampiankina
"""Ary efa dimy amby fito-polo taona Abrama, raha niala tao Harana izy.""",Mpampitohy Tambinteny Mpamaritra Anarana Mpamaritra Mpamaritra Anarana Anarana Mpampitohy Matoanteny Tambinteny Anarana Mpisolo
"""Ary Abrama nitondra an'i Saray vadiny sy Lota zana-drahalahiny mbamin'ny fananan'izy rehetra izay efa nohariny sy ny olona izay efa azony tao Harana; dia niainga izy ireo hankany amin'ny tany Kanana, ka tonga tany amin'ny tany Kanana izy.""",Mpampitohy Anarana Matoanteny Tambinteny Mpanoritra Anarana Anarana Mpampitohy Anarana Anarana Anarana Mpampiankina Mpanoritra Anarana Mpisolo Mpamaritra Mpisolo Tambinteny Matoanteny Mpampitohy Mpanoritra Anarana Mpisolo Tambinteny Matoanteny Tambinteny Anarana Kianteny Matoanteny Mpisolo Mpisolo Matoanteny Mpampiankina Mpanoritra Anarana Anarana Kianteny Matoanteny Tambinteny Mpampiankina Mpanoritra Anarana Anarana Mpisolo
"""Ary Abrama dia nitety ny tany hatrany Sekema, dia tao an-kazo terebintan'i More.""",Mpampitohy Anarana Kianteny Matoanteny Mpanoritra Anarana Tambinteny Anarana Kianteny Tambinteny Tambinteny Anarana Anarana Mpanoritra Anarana
"""Ary ny Kananita no tompon-tany tany Kanana fahizay.""",Mpampitohy Mpanoritra Anarana Kianteny Anarana Anarana Tambinteny Anarana Tambinteny
"""Ary Jehovah niseho tamin'i Abrama ka nanao hoe: Ny taranakao no homeko ity tany ity.""",Mpampitohy Anarana Matoanteny Mpampiankina Mpanoritra Anarana Kianteny Matoanteny Tambinteny Mpanoritra Anarana Kianteny Matoanteny Mpisolo Anarana Mpisolo
"""Dia nanorina alitara teo izy ho an'i Jehovah Izay niseho taminy.""",Mpampitohy Matoanteny Anarana Tambinteny Mpisolo Kianteny Kianteny Mpanoritra Anarana Mpisolo Matoanteny Mpampiankina
"""Ary nifindra niala teo izy hankany amin'ny tendrombohitra atsinanan'i Betela ka nanorina ny lainy teo anelanelan'i Betela tao andrefany sy Ay tao atsinanany; dia nanorina alitara teo koa ho an'i Jehovah izy ka niantso ny anaran'i Jehovah.""",Mpampitohy Matoanteny Matoanteny Tambinteny Mpisolo Matoanteny Mpampiankina Mpanoritra Anarana Anarana Mpanoritra Anarana Kianteny Matoanteny Mpanoritra Anarana Tambinteny Tambinteny Mpanoritra Anarana Tambinteny Anarana Mpampitohy Tambinteny Tambinteny Anarana Kianteny Matoanteny Anarana Tambinteny Mpampitohy Kianteny Tambinteny Mpanoritra Anarana Mpisolo Kianteny Matoanteny Mpanoritra Anarana Mpanoritra Anarana
"""Ary nifindra Abrama ka nandroso niandalana ho any amin'ny tany atsimo.""",Mpampitohy Matoanteny Anarana Kianteny Matoanteny Matoanteny Kianteny Tambinteny Mpampiankina Mpanoritra Anarana Anarana
"""Ary nisy mosary teo amin'ny tany; ary Abrama dia nidina nankany Egypta hivahiny any, fa mafy ny mosary teo amin'ny tany.""",Mpampitohy Matoanteny Matoanteny Tambinteny Mpampiankina Mpanoritra Anarana Mpanoritra Anarana Kianteny Matoanteny Matoanteny Anarana Matoanteny Tambinteny Tambinteny Matoanteny Mpanoritra Matoanteny Tambinteny Mpampiankina Mpanoritra Anarana
"""Ary rehefa nadiva ho tonga tany Egypta izy, dia hoy izy tamin'i Saray vadiny: Indro, fantatro fa vehivavy tsara tarehy ianao, ka, raha hitan'ny Egyptiana, dia hataony hoe: Vadiny io; ka hovonoiny aho, fa ianao kosa hovelominy.""",Mpampitohy Tambinteny Matoanteny Kianteny Matoanteny Tambinteny Anarana Mpisolo Kianteny Mpamaritra Mpisolo Mpampiankina Mpanoritra Anarana Anarana Tenim-piotanana Matoanteny Tambinteny Anarana Mpamaritra Anarana Mpisolo Kianteny Mpampitohy Matoanteny Mpanoritra Anarana Kianteny Matoanteny Tambinteny Anarana Tambinteny Kianteny Matoanteny Mpisolo Tambinteny Mpisolo Mpampitohy Matoanteny
"""Masìna ianao, lazao fa anabaviko ianao, mba hasiany soa aho noho ny aminao, ka ianao no hamelomany ahy.""",Mpamaritra Mpisolo Matoanteny Tambinteny Anarana Mpisolo Kianteny Matoanteny Mpamaritra Mpisolo Mpampitohy Mpanoritra Mpisolo Kianteny Mpisolo Kianteny Matoanteny Mpisolo
"""Ary rehefa tonga tany Egypta Abrama, dia hitan'ny Egyptiana fa tsara tarehy indrindra ravehivavy.""",Mpampitohy Tambinteny Matoanteny Tambinteny Anarana Anarana Kianteny Matoanteny Mpanoritra Anarana Tambinteny Mpamaritra Anarana Tambinteny Anarana
"""Ary nahita azy ny tandapan'i Farao ka nidera azy tamin'i Farao; dia nentina tao an-tranon'i Farao izy.""",Mpampitohy Matoanteny Mpisolo Mpanoritra Anarana Mpanoritra Anarana Kianteny Matoanteny Mpisolo Mpampiankina Mpanoritra Anarana Kianteny Matoanteny Tambinteny Tambinteny Anarana Mpanoritra Anarana Mpisolo
"""Ary Abrama nasian'i Farao soa noho ny amin'i Saray; dia nahazo ondry sy omby sy borikilahy sy andevolahy sy andevovavy sy borikivavy sy rameva izy.""",Mpampitohy Anarana Matoanteny Mpanoritra Anarana Mpamaritra Mpampitohy Mpanoritra Mpampiankina Mpanoritra Anarana Kianteny Matoanteny Anarana Mpampitohy Anarana Mpampitohy Anarana Mpampitohy Anarana Mpampitohy Anarana Mpampitohy Anarana Mpampitohy Anarana Mpisolo
"""Dia nasian'i Jehovah areti-mandoza Farao sy ny ankohonany noho ny amin'i Saray, vadin'i Abrama.""",Kianteny Matoanteny Mpanoritra Anarana Anarana Matoanteny Anarana Mpampitohy Mpanoritra Anarana Mpampitohy Mpanoritra Mpampiankina Mpanoritra Anarana Anarana Mpanoritra Anarana
"""Ary Farao dia nampaka an'i Abrama ka nanao hoe: Inona izao nataonao tamiko izao? Nahoana no tsy nambaranao tamiko fa vadinao izy? Nahoana ianao no nanao hoe: Anabaviko izy? ka nalaiko ho vady izy; koa ankehitriny, indro ny vadinao, ento izy, ka mandehana.""",Mpampitohy Anarana Kianteny Matoanteny Tambinteny Mpanoritra Anarana Kianteny Matoanteny Tambinteny Mpisolo Mpisolo Matoanteny Mpisolo Mpisolo Tambinteny Kianteny Tambinteny Matoanteny Mpisolo Tambinteny Anarana Mpisolo Tambinteny Mpisolo Kianteny Matoanteny Tambinteny Anarana Mpisolo Kianteny Matoanteny Kianteny Anarana Mpisolo Mpampitohy Tambinteny Tenim-piotanana Mpanoritra Anarana Matoanteny Mpisolo Kianteny Matoanteny
"""Dia nomen'i Farao teny ny mpanompony sasany ny amin'i Abrama; ary dia nanatitra azy sy ny vadiny mbamin'ny fananany rehetra ireo.""",Mpampitohy Matoanteny Mpanoritra Anarana Anarana Mpanoritra Anarana Mpamaritra Mpanoritra Mpampiankina Mpanoritra Anarana Mpampitohy Kianteny Matoanteny Mpisolo Mpampitohy Mpanoritra Anarana Mpampiankina Mpanoritra Anarana Mpamaritra Mpisolo
"""Ary Abrama dia niakatra niala tany Egypta, dia izy sy ny vadiny mbamin'ny fananany rehetra, ary Lota koa niaraka taminy, ho any amin'ny tany atsimo.""",Mpampitohy Anarana Kianteny Matoanteny Matoanteny Tambinteny Anarana Kianteny Mpisolo Mpampitohy Mpanoritra Anarana Mpampiankina Mpanoritra Anarana Mpamaritra Mpampitohy Anarana Mpampitohy Matoanteny Mpampiankina Kianteny Tambinteny Mpampiankina Mpanoritra Anarana Anarana
"""Ary Abrama nanana harena be, dia omby aman'ondry sy volafotsy ary volamena.""",Mpampitohy Anarana Matoanteny Anarana Mpamaritra Kianteny Anarana Mpampiankina Anarana Mpampitohy Anarana Mpampitohy Anarana
"""Ary mbola nandeha ihany izy ka nifindrafindra hatrany amin'ny tany atsimo ka hatrany Betela, izay niorenan'ny lainy tamin'ny voalohany, teo anelanelan'i Betela sy Ay, dia teo amin'ny tany izay nisy ilay alitara nataony tamin'ny voalohany; ary dia niantso ny anaran'i Jehovah teo Abrama.""",Mpampitohy Tambinteny Matoanteny Tambinteny Mpisolo Kianteny Matoanteny Tambinteny Mpampiankina Mpanoritra Anarana Anarana Kianteny Tambinteny Anarana Mpisolo Matoanteny Mpanoritra Anarana Mpampiankina Mpanoritra Mpamaritra Tambinteny Tambinteny Mpanoritra Anarana Mpampitohy Anarana Kianteny Tambinteny Mpampiankina Mpanoritra Anarana Mpisolo Matoanteny Mpanoritra Anarana Matoanteny Mpampiankina Mpanoritra Anarana Mpampitohy Kianteny Matoanteny Mpanoritra Anarana Mpanoritra Anarana Tambinteny Anarana
"""Ary Lota koa, izay niara-nandeha tamin'i Abrama, dia mba nanana ondry sy omby sy lay.""",Mpampitohy Anarana Mpampitohy Mpisolo Matoanteny Matoanteny Mpampiankina Mpanoritra Anarana Kianteny Kianteny Matoanteny Anarana Mpampitohy Anarana Mpampitohy Anarana
"""Ary tsy omby azy roa lahy ny tany hiraisany monina; fa efa be ny fananany, ka tsy nahazo niray monina izy.""",Mpampitohy Tambinteny Anarana Mpisolo Mpamaritra Anarana Mpanoritra Anarana Matoanteny Matoanteny Tambinteny Tambinteny Mpamaritra Mpanoritra Anarana Kianteny Tambinteny Matoanteny Matoanteny Matoanteny Mpisolo
"""Dia niady ny mpiandry ombin'i Abrama sy ny mpiandry ombin'i Lota; ary ny Kananita sy ny Perizita no tompon-tany tao Kanana fahizay.""",Mpampitohy Matoanteny Mpanoritra Anarana Anarana Mpanoritra Anarana Mpampitohy Mpanoritra Anarana Anarana Mpanoritra Anarana Mpampitohy Mpanoritra Anarana Mpampitohy Mpanoritra Anarana Kianteny Anarana Anarana Tambinteny Anarana Tambinteny
"""Ary hoy Abrama tamin'i Lota: Aoka re mba tsy hisy ady amintsika roa lahy, na amin'ny mpiandry ombiko sy ny mpiandry ombinao, fa mpirahalahy isika.""",Mpampitohy Mpamaritra Anarana Mpampiankina Mpanoritra Anarana Tenim-piotanana Kianteny Kianteny Tambinteny Matoanteny Anarana Mpisolo Mpamaritra Anarana Kianteny Mpampiankina Mpanoritra Anarana Anarana Mpampitohy Mpanoritra Anarana Anarana Tambinteny Anarana Mpisolo
"""Moa tsy eo anoloanao va ny tany rehetra? Masìna ianao, aoka hisaraka amiko ianao; raha hianavaratra ianao.""",Kianteny Tambinteny Tambinteny Matoanteny Kianteny Mpanoritra Anarana Mpamaritra Mpamaritra Mpisolo Tenim-piotanana Matoanteny Mpisolo Mpisolo Mpampitohy Matoanteny Mpisolo
"""Dia hianatsimo aho; fa raha hianatsimo ianao, dia hianavaratra kosa aho.""",Mpampitohy Matoanteny Mpisolo Tambinteny Mpampitohy Matoanteny Mpisolo Kianteny Matoanteny Mpampitohy Mpisolo
"""Ary Lota nanopy ny masony ka nitazana ny tany rehetra teny amoron'i Jordana hatrany akaikin'i Zoara, fa azon-drano avokoa izy rehetra (talohan'ny nandravan'i Jehovah an'i Sodoma sy Gomora izany), tahaka ny sahan'i Jehovah sy tahaka ny tany Egypta.""",Mpampitohy Anarana Matoanteny Mpanoritra Anarana Kianteny Matoanteny Mpanoritra Anarana Mpamaritra Tambinteny Matoanteny Mpanoritra Anarana Tambinteny Matoanteny Mpanoritra Anarana Tambinteny Anarana Anarana Mpamaritra Mpisolo Mpamaritra Tambinteny Mpanoritra Matoanteny Mpanoritra Anarana Tambinteny Mpanoritra Anarana Mpampitohy Anarana Mpisolo Mpamaritra Mpanoritra Anarana Mpanoritra Anarana Mpampitohy Mpamaritra Mpanoritra Anarana Anarana
"""Dia nofidin'i Lota ho azy ny tany rehetra amoron'i Jordana, ka nifindra niantsinanana izy; ka dia nisaraka izy roa lahy.""",Mpampitohy Matoanteny Mpanoritra Anarana Kianteny Mpisolo Mpanoritra Anarana Mpamaritra Tambinteny Mpanoritra Anarana Kianteny Matoanteny Matoanteny Mpisolo Kianteny Kianteny Matoanteny Mpisolo Mpamaritra Anarana
"""Ary Abrama nonina tao amin'ny tany Kanana.""",Mpampitohy Anarana Matoanteny Tambinteny Mpampiankina Mpanoritra Anarana Anarana
"""Fa Lota kosa nonina tao an-tanàna amin'ny tany amoron'i Jordana ka nifindrafindra toby hatrany Sodoma.""",Tambinteny Anarana Mpampitohy Matoanteny Tambinteny Tambinteny Anarana Mpampiankina Mpanoritra Anarana Tambinteny Mpanoritra Anarana Kianteny Matoanteny Anarana Tambinteny Anarana
"""Ary ny mponina tao Sodoma dia tena ratsy fanahy sady mpanota indrindra tamin'i Jehovah.""",Mpampitohy Mpanoritra Anarana Tambinteny Anarana Kianteny Anarana Mpamaritra Anarana Mpampitohy Anarana Tambinteny Mpampiankina Mpanoritra Anarana
"""Ary Jehovah niteny tamin'i Abrama taorian'ny nisarahan'i Lota taminy ka nanao hoe: Atopazy ny masonao, ka hatramin'ity tany itoeranao ity dia mitazana mianavaratra sy mianatsimo ary miantsinanana sy miankandrefana; fa ny tany rehetra izay tazanao dia homeko anao sy ny taranakao mandrakizay.""",Mpampitohy Anarana Matoanteny Mpampiankina Mpanoritra Anarana Tambinteny Mpanoritra Matoanteny Mpanoritra Anarana Mpampiankina Kianteny Matoanteny Tambinteny Matoanteny Mpanoritra Anarana Kianteny Tambinteny Mpisolo Anarana Matoanteny Mpisolo Kianteny Matoanteny Matoanteny Mpampitohy Matoanteny Mpampitohy Matoanteny Mpampitohy Matoanteny Tambinteny Mpanoritra Anarana Mpamaritra Mpisolo Anarana Kianteny Matoanteny Mpisolo Mpampitohy Mpanoritra Anarana Tambinteny 
"""Ary hataoko maro tahaka ny vovo-tany ny taranakao; koa raha misy olona mahisa ny vovo-tany, dia ho azo isaina koa ny taranakao.""",Mpampitohy Matoanteny Mpamaritra Mpamaritra Mpanoritra Anarana Anarana Mpanoritra Anarana Mpampitohy Mpampitohy Matoanteny Anarana Matoanteny Mpanoritra Anarana Anarana Kianteny Kianteny Matoanteny Matoanteny Mpampitohy Mpanoritra Anarana
"""Miaingà ianao, mandehana mitety ny tany, dia any amin'ny lavany sy any amin'ny sakany; fa homeko anao izy.""",Matoanteny Mpisolo Matoanteny Matoanteny Mpanoritra Anarana Kianteny Tambinteny Mpampiankina Mpanoritra Anarana Mpampitohy Tambinteny Mpampiankina Mpanoritra Anarana Tambinteny Matoanteny Mpisolo Mpisolo 
"""Ary Abrama nifindrafindra toby.""",Mpampitohy Anarana Matoanteny Anarana
"""Dia nandeha ka nonina teo an-kazo terebintan'i Mamre, izay any Hebrona, ary nanorina alitara teo ho an'i Jehovah izy.""",Mpampitohy Matoanteny Kianteny Matoanteny Tambinteny Tambinteny Anarana Anarana Mpanoritra Anarana Mpisolo Tambinteny Anarana Mpampitohy Matoanteny Anarana Tambinteny Kianteny Tambinteny Mpanoritra Anarana Mpisolo
"""Ary tamin'ny andron'i Amrafela mpanjakan'i Sinara, sy Arioka, mpanjakan'i Elasara sy Kedorlaomera mpanjakan'i Elama ary Tidala mpanjakan'ny Goima, dia nandeha izy ireo ka nanafika an'i Bera, mpanjakan'i Sodoma sy Birsa, mpanjakan'i Gomora sy Sinaba, mpanjakan'i Adma, sy Semebera, mpanjakan'i Zeboima, ary ny mpanjakan'i Bela (dia Zoara izany).""",Mpampitohy Mpampiankina Mpanoritra Anarana Mpanoritra Anarana Anarana Mpanoritra Anarana Mpampitohy Anarana Anarana Mpanoritra Anarana Mpampitohy Anarana Anarana Mpanoritra Anarana Mpampitohy Anarana Anarana Mpanoritra Anarana Kianteny Matoanteny Mpisolo Mpisolo Kianteny Matoanteny Tambinteny Mpanoritra Anarana Anarana Mpanoritra Anarana Mpampitohy Anarana Anarana Mpanoritra Anarana Mpampitohy Anarana Anarana Mpanoritra Anarana Mpampitohy Anarana Anarana Mpanoritra Anarana Mpampitohy Mpanoritra Anarana Mpanoritra Anarana Kianteny Anarana Mpisolo
"""Ary ireo rehetra ireo dia nanao fotoana ka nivory tao an-dohasahan'i Sidima (dia ny Ranomasin-tsira izany).""",Mpampitohy Mpisolo Mpamaritra Mpisolo Kianteny Matoanteny Anarana Kianteny Matoanteny Tambinteny Tambinteny Anarana Mpanoritra Anarana Kianteny Mpanoritra Anarana Anarana Mpisolo
"""Fa efa nanompo an'i Kedorlaomera roa ambin'ny folo taona ireo, fa tamin'ny taona fahatelo ambin'ny folo kosa dia niodina izy.""",Tambinteny Tambinteny Matoanteny Tambinteny Mpanoritra Anarana Mpamaritra Anarana Mpanoritra Mpamaritra Anarana Mpisolo Tambinteny Mpampiankina Mpanoritra Anarana Tambinteny Anarana Mpanoritra Mpamaritra Mpampitohy Kianteny Matoanteny Mpisolo
"""Ary tamin'ny taona fahefatra ambin'ny folo dia tonga Kedorlaomera sy ireo mpanjaka nomba azy ka namely ny Refaita tany Astarta-karnaima sy ny Zozima tany Hama ary ny Emima tany Save-kiriataima ary ny Horita tany an-tendrombohitra Seira hatrany Elparana, izay eo anilan'ny efitra.""",Mpampitohy Mpampiankina Mpanoritra Anarana Tambinteny Anarana Mpanoritra Mpamaritra Kianteny Matoanteny Anarana Mpampitohy Mpisolo Anarana Matoanteny Mpisolo Kianteny Matoanteny Mpanoritra Anarana Tambinteny Anarana Anarana Mpampitohy Mpanoritra Anarana Tambinteny Anarana Mpampitohy Mpanoritra Anarana Tambinteny Anarana Anarana Mpampitohy Mpanoritra Anarana Tambinteny Tambinteny Anarana Anarana Tambinteny Anarana Mpisolo Tambinteny Tambinteny Mpanoritra Anarana
"""Dia niverina indray izy ireo ka nankany Ena-mispata (dia Kadesy izany) ka namely ny tany rehetra an'ny Amalekita sy ny Amorita koa, izay nonina tany Hazazon-tamara.""",Mpanoritra Matoanteny Tambinteny Mpisolo Mpisolo Kianteny Matoanteny Anarana Anarana Kianteny Anarana Mpisolo Kianteny Matoanteny Mpanoritra Anarana Mpamaritra Tambinteny Mpanoritra Anarana Mpampitohy Mpanoritra Anarana Mpampitohy Mpisolo Matoanteny Tambinteny Anarana Anarana 
"""Dia nivoaka ny mpanjakan'i Sodoma sy ny mpanjakan'i Gomora sy ny mpanjakan'i Adma sy ny mpanjakan'i Zeboima ary ny mpanjakan'i Bela (dia Zoara izany) ka nilahatra hiady amin'ireo teo an-dohasahan'i Sidima, dia tamin'i Kedorlaomera, mpanjakan'i Elama, sy Tidala, mpanjakan'ny Goima sy Amrafela, mpanjakan'i Sinara ary Arioka, mpanjakan'i Elasara; dia mpanjaka efatra no niady tamin'ny mpanjaka dimy.""",Mpampitohy Matoanteny Mpanoritra Anarana Mpanoritra Anarana Mpampitohy Mpanoritra Anarana Mpanoritra Anarana Mpampitohy Mpanoritra Anarana Mpanoritra Anarana Mpampitohy Mpanoritra Anarana Mpanoritra Anarana Mpampitohy Mpanoritra Anarana Mpanoritra Anarana Kianteny Anarana Mpisolo Kianteny Matoanteny Matoanteny Mpampiankina Mpisolo Tambinteny Tambinteny Anarana Mpanoritra Anarana Kianteny Mpampiankina Mpanoritra Anarana Anarana Mpanoritra Anarana Mpampitohy Anarana Anarana Mpanoritra Anarana Mpampitohy Anarana Anarana Mpanoritra Anarana Mpampitohy Anarana Anarana Mpanoritra Anarana Kianteny Anarana Mpamaritra Kianteny Matoanteny Mpampiankina Mpanoritra Anarana Mpamaritra 
"""Ary ny lohasahan'i Sidima, dia be lavak'asfalta, ary nandositra ny mpanjakan'i Sodoma sy ny mpanjakan'i Gomora ka latsaka tao; ary ny sisa nandositra tany an-tendrombohitra.""",Mpampitohy Mpanoritra Anarana Mpanoritra Anarana Kianteny Mpamaritra Anarana Anarana Mpampitohy Matoanteny Mpanoritra Anarana Mpanoritra Anarana Mpampitohy Mpanoritra Anarana Mpanoritra Anarana Kianteny Anarana Tambinteny Mpampitohy Mpanoritra Mpamaritra Matoanteny Tambinteny Tambinteny Anarana
"""Ary izy ireo namabo ny fananana rehetra tao Sodoma sy Gomora ary ny hanina rehetra.""",Mpampitohy Mpisolo Mpisolo Matoanteny Mpanoritra Anarana Mpamaritra Tambinteny Anarana Mpampitohy Anarana Mpampitohy Mpanoritra Anarana Mpamaritra
"""Ary namabo ny zana-drahalahin'i Abrama koa izy, dia Lota, mbamin'ny fananany, dia lasa nandeha; fa nonina tao Sodoma koa Lota.""",Mpampitohy Matoanteny Mpanoritra Anarana Anarana Mpanoritra Anarana Mpampitohy Mpisolo Kianteny Anarana Mpampiankina Mpanoritra Anarana Kianteny Matoanteny Matoanteny Tambinteny Matoanteny Tambinteny Anarana Mpampitohy Anarana
"""Ary tonga ny anankiray izay efa nandositra ka nanambara tamin'i Abrama Hebreo izay nonina teo an-kazo terebintan'i Mamre Amorita, rahalahin'i Eskola sy Anera; fa ireo dia olona efa vita fanekena tamin'i Abrama.""",Mpampitohy Matoanteny Mpanoritra Tambinteny Mpisolo Tambinteny Matoanteny Kianteny Matoanteny Mpampiankina Mpanoritra Anarana Anarana Mpisolo Matoanteny Tambinteny Tambinteny Anarana Anarana Mpanoritra Anarana Anarana Anarana Mpampitohy Anarana Mpampitohy Anarana Tambinteny Mpisolo Kianteny Anarana Tambinteny Matoanteny Anarana Mpampiankina Mpanoritra Anarana
"""Ary raha nahare Abrama fa lasan-ko babo ny rahalahiny dia nitondra ny ompikeliny valo ambin'ny folo amby telon-jato izy, izay efa nahay niady.""",Mpampitohy Mpampitohy Matoanteny Anarana Tambinteny Anarana Mpamaritra Anarana Mpanoritra Anarana Kianteny Matoanteny Mpanoritra Anarana Mpamaritra Anarana Mpanoritra Mpamaritra Anarana Mpamaritra Mpamaritra Mpisolo Mpisolo Tambinteny Matoanteny Matoanteny 
"""Ka nanenjika hatrany Dana.""",Kianteny Matoanteny Tambinteny Anarana
